,Title,Published_date,Views,Likes,Favourite,Month
0,Dale's BEST Lines in Fairfax #shorts | Prime Video,2022-02-02,1014,71,0,Feb
1,The Boys Presents: Diabolical - Teaser | Prime Video,2022-02-02,38023,1173,0,Feb
2,Cinderella's life is lowkey crazy #shorts | Prime Video,2022-02-01,2176,82,0,Feb
3,I Want You Back - Official Trailer | February 11 | Prime Video,2022-02-01,1521250,627,0,Feb
4,How Jimmy O Yang's dad shows love #shorts | Prime Video,2022-01-31,3682,293,0,Jan
5,Being the Ricardos Official Cast Roundtable | Prime Video,2022-01-28,37116,288,0,Jan
6,As We See It: Cast Panel at Sundance | Prime Video,2022-01-25,62871,322,0,Jan
7,As We See It | Premiere Panel Discussion,2022-01-24,59599,208,0,Jan
8,Best Family Movies to Watch on Prime Video,2022-01-23,5841,191,0,Jan
9,Invincible Musical Score | Prime Video,2022-01-22,45303,552,0,Jan
10,Welcome to The Drama Club | Prime Video,2022-01-20,4129,67,0,Jan
11,The Legend of Vox Machina - Try To Do Some Good Clip | Prime Video,2022-01-20,342581,14755,0,Jan
12,Phat Tuesdays: The Era of Hip Hop Comedy – Official Trailer I February 4,2022-01-20,6688,177,0,Jan
13,Upload - Season 1 Recap | Prime Video,2022-01-20,29626,459,0,Jan
14,The Panic Cast Shares Their Craziest Dreams | Prime Video,2022-01-19,43653,156,0,Jan
15,LOL: Last One Laughing Canada - Official Trailer | Prime Video,2022-01-19,12413,167,0,Jan
16,The Lord of the Rings: The Rings of Power  - Title Announcement | Prime Video,2022-01-19,3518461,69285,0,Jan
17,Le Seigneur des anneaux : Les anneaux de pouvoir - Annonce du titre | Prime Video,2022-01-19,431,21,0,Jan
18,Elite Anime On Prime Video | Anime Club,2022-01-18,55650,587,0,Jan
19,Reacher - Prison Brawl | Prime Video,2022-01-18,373271,3601,0,Jan
20,The Boys Presents: Diabolical - First Look - Laser Baby | Prime Video,2022-01-18,133826,3135,0,Jan
21,The Expanse Series Finale Explained | The Takeaway | Prime Video,2022-01-15,73685,1750,0,Jan
22,The Expanse Aftershow S6E6 – Wes Chatham & Ty Franck w/ Dominique Tipper & Steven Strait,2022-01-15,194698,6191,0,Jan
23,"As We See It - Clip: ""Who Wants to Start"" | Prime Video",2022-01-14,5231,97,0,Jan
24,Hotel Transylvania: Transformania – Werewolf of Dance | Prime Video,2022-01-14,38829,391,0,Jan
25,Hôtel Transylvanie: Changements Monstres - Bande-annonce officielle VF | Prime Video,2022-01-13,253,37,0,Jan
26,The Legend of Vox Machina - Trailer (Red Band Trailer) | Prime Video,2022-01-12,4855274,53895,0,Jan
27,The Best of Jim and Jack from Jack Ryan | Prime Video,2022-01-09,53672,456,0,Jan
28,Hotel Transylvania: Transformania – Retirement | Prime Video,2022-01-09,77048,969,0,Jan
29,Feel-Good Movies on Prime Video,2022-01-08,52814,305,0,Jan
30,The Expanse Aftershow S6E5 – Wes Chatham & Ty Franck w/ Shohreh Aghdashloo & Cara Gee,2022-01-08,130061,3320,0,Jan
31,Hotel Transylvania: Transformania – Texting | Prime Video,2022-01-07,15715,365,0,Jan
32,The Boys - Season 3 First Look | Prime Video,2022-01-07,360932,9480,0,Jan
33,The Expanse Season 6 - Naomi & Drummer Clip | Prime Video,2022-01-06,21942,486,0,Jan
34,Building the World of the Wheel of Time - Part 2 | Prime Video,2022-01-02,64660,1042,0,Jan
35,Building the World of the Wheel of Time | Prime Video,2022-01-01,102133,1131,0,Jan
36,New To Prime Video January 2022,2022-01-01,86863,753,0,Jan
37,The Expanse Aftershow S6E4 – Wes Chatham & Ty Franck w/ Dan Nowak,2022-01-01,70981,947,0,Jan
38,Finding the Perfect Cast for the Wheel of Time - Part 1 | Prime Video,2021-12-31,133450,1929,0,Dec
39,Finding the Perfect Cast for the Wheel of Time - Part 2 | Prime Video,2021-12-30,97178,1960,0,Dec
40,The Expanse Season 6 - Naomi & Holden Clip | Prime Video,2021-12-30,8311,295,0,Dec
41,Inside the Wheel of Time: Episode 8 (ft Madeleine Madden) | Prime Video,2021-12-28,74046,1309,0,Dec
42,The Expanse Season 6 - Amos & Peaches Clip | Prime Video,2021-12-28,17325,409,0,Dec
43,Creating Weapons and Props for the Wheel of Time | Prime Video,2021-12-27,13068,539,0,Dec
44,What The Wilds Cast Would Bring to a Deserted Island | Prime Video,2021-12-27,12909,690,0,Dec
45,Creating the Music for the Wheel of Time | Prime Video,2021-12-26,16574,785,0,Dec
46,Creating In-World Music for the Wheel of Time | Prime Video,2021-12-25,14785,676,0,Dec
47,The Expanse Aftershow S6E3 – Wes Chatham & Ty Franck w/ Keon Alexander,2021-12-25,86394,1793,0,Dec
48,The Wheel of Time - Meet Showrunner Rafe Judkins | Prime Video,2021-12-23,16691,767,0,Dec
49,The Expanse Season 6 - Yule Log | Prime Video,2021-12-23,13245,353,0,Dec
50,Best Romance Anime on Prime Video | Anime Club,2021-12-22,51283,813,0,Dec
51,Bringing the Wheel of Time Costumes to Life: Part 2 | Prime Video,2021-12-22,74457,1340,0,Dec
52,Bringing the Wheel of Time Costumes to Life: Part 1 | Prime Video,2021-12-22,116109,1621,0,Dec
53,Inside the Wheel of Time: Episode 7 (ft Nick Dudman & Julian Parry) | Prime Video,2021-12-21,78209,1543,0,Dec
54,With Love Musical Score | Prime Video,2021-12-20,2731,87,0,Dec
55,I Want You Back - Official Trailer | Prime Video,2021-12-20,1901764,4813,0,Dec
56,Meet the Cast of With Love | Prime Video,2021-12-19,4761,134,0,Dec
57,The Wheel of Time - A Look Inside Episode 7 | Prime Video,2021-12-18,144637,4097,0,Dec
58,The Expanse Aftershow S6E2 – Wes Chatham & Ty Franck w/ Frankie Adams & Nadine Nicole,2021-12-18,111220,1866,0,Dec
59,#SHORTS | Celebrating 40 Years of Metallica,2021-12-17,5364,186,0,Dec
60,Laugh Track – Prime Video’s Home for Comedy | Prime Video,2021-12-17,1943,53,0,Dec
61,The Expanse Season 6 - Marco & Rosenfeld Clip | Prime Video,2021-12-16,7007,228,0,Dec
62,How Robert Jordan Got His Start | The Wheel of Time | Prime Video,2021-12-16,28991,1442,0,Dec
63,The Wheel of Time - A Look Inside Episode 6 | Prime Video,2021-12-15,65095,1375,0,Dec
64,Shatner In Space | Prime Video,2021-12-15,14778,277,0,Dec
65,The Wheel Of Time – Episode 7 Preview | Prime Video,2021-12-15,112904,2537,0,Dec
66,Inside the Wheel of Time: Episode 6 (ft Daniel Henney) | Prime Video,2021-12-14,72711,2184,0,Dec
67,The Making of the Winternight Sequence | The Wheel of Time | Prime Video,2021-12-13,79108,1949,0,Dec
68,The Wheel of Time - A Look Inside Episode 5 | Prime Video,2021-12-12,64108,1358,0,Dec
69,The Wheel of Time - A Look Inside Episode 4 | Prime Video,2021-12-12,46106,751,0,Dec
70,The Wheel of Time – A Look Inside Episode 3 | Prime Video,2021-12-11,54321,924,0,Dec
71,The Wheel of Time – A Look Inside Episode 2 | Prime Video,2021-12-11,68022,1208,0,Dec
72,"The Expanse Aftershow S6E1 – Wes Chatham, Ty Franck w/ Naren Shankar, Daniel Abraham & Breck Eisner",2021-12-11,135002,2334,0,Dec
73,The Wheel of Time – A Look Inside Episode 1 | Prime Video,2021-12-11,48876,982,0,Dec
74,Stovetop Kisses Harlem Inspired Meal Pairing | Prime Video,2021-12-10,2110,98,0,Dec
75,#SHORTS | Being the Ricardos - In Theaters Now,2021-12-10,5438,167,0,Dec
76,Prime Video - Fashion - See Where It Takes You,2021-12-10,2923,50,0,Dec
77,Prime Video - Fantasy - See Where It Takes You,2021-12-10,11164,289,0,Dec
78,Book of Love – Official Trailer | February 4,2021-12-09,351219,6654,0,Dec
79,Yearly Departed - Official Trailer (2021) | Prime Video,2021-12-09,46693,387,0,Dec
80,The Wheel Of Time – Episode 6 Preview | Prime Video,2021-12-08,109366,2270,0,Dec
81,Hotel Transylvania: Transformania – Official Trailer | January 14,2021-12-08,6355290,8329,0,Dec
82,Inside the Wheel of Time: Episode 5 (ft Isis Mussenden) | Prime Video,2021-12-07,67842,1575,0,Dec
83,"Talking with Cast from The Wheel of Time, The Boys & More at CCXP Worlds 2021",2021-12-06,17907,531,0,Dec
84,The Boys Presents: Diabolical - Title Reveal | Prime Video,2021-12-06,56725,2268,0,Dec
85,Cuppie's Best Moments from Tampa Baes | Prime Video,2021-12-05,5423,91,0,Dec
86,Comic Fans React to Gruesome Invincible Scenes | Superhero Club | Prime Video,2021-12-04,37910,398,0,Dec
87,New To Prime Video December 2021,2021-12-03,23333,391,0,Dec
88,Amazon Prime Video South Africa,2021-12-03,1168125,115,0,Dec
89,The Marvelous Mrs. Maisel Season 4 - Official Teaser #4 | Prime Video,2021-12-03,472668,5540,0,Dec
90,Reacher - Official Trailer | Prime Video,2021-12-02,4430807,11330,0,Dec
91,The Marvelous Mrs. Maisel Season 4 - Official Teaser #3 | Prime Video,2021-12-02,325286,4076,0,Dec
92,Prime Video - Action - See Where It Takes You,2021-12-01,7878,210,0,Dec
93,With Love - Official Trailer | Prime Video,2021-12-01,1628743,5581,0,Dec
94,The Marvelous Mrs. Maisel Season 4 - Official Teaser #2 | Prime Video,2021-12-01,539155,7187,0,Dec
95,Inside the Wheel of Time: Episode 4 (ft Zoë Robins) | Prime Video,2021-11-30,208147,2876,0,Nov
96,The Marvelous Mrs. Maisel Season 4 - Official Teaser | Prime Video,2021-11-30,2508923,13555,0,Nov
97,Martha Blackburn's Best Moments | The Wilds | Prime Video,2021-11-28,91333,524,0,Nov
98,I Know What You Did Last Summer Cast Tells Secrets | Prime Video,2021-11-27,30046,183,0,Nov
99,Good Omens - Best Foodie Moments | Prime Video,2021-11-26,34528,343,0,Nov
100,The Marvelous Mrs. Maisel Best Food Moments Part 2 | Prime Video,2021-11-25,61479,410,0,Nov
101,Hanna Season Three Clip: Hanna's Second Mission | Prime Video,2021-11-24,36751,249,0,Nov
102,"Inside the Wheel of Time: Episode 1,2, 3 (ft Marcus Rutherford) | Prime Video",2021-11-23,288338,4404,0,Nov
103,#SHORTS | We Animated Tiffany Haddish's Dream About Her Fish Babies,2021-11-22,13815,129,0,Nov
104,As We See It - Official Trailer | Prime Video,2021-11-22,234061,2908,0,Nov
105,Best Invincible TikToks Compilation | Prime Video,2021-11-21,42077,896,0,Nov
106,The Perfect Meal to Pair with The Tomorrow War | Prime Video,2021-11-20,31953,175,0,Nov
107,The Wheel of Time: The First Turn (Amazon Original Series Soundtrack),2021-11-19,593288,4042,0,Nov
108,The Wheel of Time Fans React to Episodes 1 and 2 | Prime Video,2021-11-19,79245,809,0,Nov
109,The Expanse: Looking Back with the Cast at NYCC 2021 | Prime Video,2021-11-18,263054,1673,0,Nov
110,Tabasko Sweet Explores The Boys and Fairfax at ComplexCon 2021 | Prime Video,2021-11-17,32460,223,0,Nov
111,Encounter – Official Trailer | Prime Video,2021-11-17,2077330,7442,0,Nov
112,The Expanse Season 6 - Official Trailer | Prime Video,2021-11-16,1268250,32922,0,Nov
113,The Legend of Vox Machina | Critical Role Cast Panel | NYCC 2021 | Prime Video,2021-11-13,152611,4661,0,Nov
114,The Wheel of Time Cast Discuss Bringing The Show to Life | Prime Video,2021-11-12,146966,1419,0,Nov
115,Former NFL Players Andrew Hawkins and Joe Thomas Play Guess the Headline | Prime Video,2021-11-11,44396,151,0,Nov
116,HANNA Season 3 – Official Trailer | Prime Video,2021-11-10,4195893,4813,0,Nov
117,Being the Ricardos - Official Trailer | Prime Video,2021-11-10,6067989,9967,0,Nov
118,#SHORTS | We Animated Steven Strait's Dream About Tidal Waves,2021-11-09,5330,242,0,Nov
119,Indigenous Peoples' Voices,2021-11-08,6494,204,0,Nov
120,Make Dessert While You Watch I Know What You Did Last Summer | Prime Video,2021-11-07,13447,122,0,Nov
121,The Take Explains The Wilds Season 1 Finale | Prime Video,2021-11-06,96888,729,0,Nov
122,Harlem Season 1 - Official Trailer | December 3 | Prime Video,2021-11-03,4500647,7897,0,Nov
123,New to Prime Video US November 2021,2021-11-02,57993,518,0,Nov
124,DIY Dr. Phil Box Logo Tee - Cheap Thrills | Fairfax | Prime Video,2021-11-01,14784,804,0,Nov
125,Top 3 Horror Anime Shows to Watch Now | Anime Club | Prime Video,2021-10-30,108567,2408,0,Oct
126,#SHORTS | Meet the characters of Fairfax,2021-10-29,5033,199,0,Oct
127,Yung Polluter - Fries on tha Flo’ (Official Music Video) | Fairfax | Prime Video,2021-10-29,13857,565,0,Oct
128,I Know What You Did Last Summer - Official Clip | Prime Video,2021-10-28,10635,216,0,Oct
129,A Hero - Official Trailer | Prime Video,2021-10-28,1183814,4121,0,Oct
130,The Wheel Of Time – Official Trailer | Prime Video,2021-10-28,7644856,60699,0,Oct
131,The Wheel of Time | Official Trailer 360 Experience | Amazon Original,2021-10-27,2046,87,0,Oct
132,La roue du temps | Bande-annonce principale en expérience 360 - Prime Video,2021-10-27,431,20,0,Oct
133,The Wheel of Time - Official Trailer 360 Experience | Prime Video,2021-10-27,3756394,9758,0,Oct
134,A Man Named Scott | Official Trailer | Prime Video,2021-10-26,2145864,5619,0,Oct
135,#SHORTS | We Animated Shohreh Aghdashloo’s Dream About Angels,2021-10-25,8591,354,0,Oct
136,The Boys - Top 10 Best Super Powers | Rank'd | Prime Video,2021-10-23,49821,294,0,Oct
137,The Wheel Of Time – Moiraine’s Quest | Prime Video,2021-10-22,570942,8363,0,Oct
138,The Wheel Of Time - Behind the Scenes | Prime Video,2021-10-20,53891,1686,0,Oct
139,The Wheel Of Time – Cosplay Inspiration | Prime Video,2021-10-20,19919,780,0,Oct
140,Everybody Loves Natti | Official Trailer in Spanish | Prime Video,2021-10-20,73692,1472,0,Oct
141,Everybody Loves Natti | Official Trailer (English) | Prime Video,2021-10-20,47100,548,0,Oct
142,Tampa Baes - Official Trailer | Prime Video,2021-10-19,1033748,897,0,Oct
143,Being the Ricardos: Official Teaser | Prime Video,2021-10-19,3380908,6690,0,Oct
144,Mayor Pete | Official Trailer | Prime Video,2021-10-18,788665,1885,0,Oct
145,5 Adam Driver Movies to Watch Now | Prime Video,2021-10-17,54471,374,0,Oct
146,The Boys - Meet the Most Badass Ladies | Prime Video,2021-10-16,45223,428,0,Oct
147,The Wheel Of Time – Logain | Prime Video,2021-10-16,116773,3237,0,Oct
148,The Wheel Of Time – Shadowspawn | Prime Video,2021-10-16,69890,1709,0,Oct
149,Iconic Hispanic and Latino Characters in Sci Fi  | Prime Video,2021-10-15,40524,283,0,Oct
150,The Expanse Recap | Seasons 1 - 5 | Prime Video,2021-10-15,193688,2690,0,Oct
151,The Tender Bar - Official Trailer | Prime Video,2021-10-14,3249309,5569,0,Oct
152,#SHORTS | We Animated Jimmy O Yang's Dream About Basketball,2021-10-13,11229,422,0,Oct
153,The Boys Vought News Network Reaction Video | Superhero Club | Prime Video,2021-10-13,41429,188,0,Oct
154,Fairfax Season 1 – Official Trailer | October 29 | Prime Video,2021-10-12,4496953,1272,0,Oct
155,Rosa Salazar Best Scenes from Undone | Prime Video,2021-10-11,28911,229,0,Oct
156,Best of Fleabag Seasons 1 + 2 | Prime Video,2021-10-10,85676,925,0,Oct
157,Hanna Season 3 - Official Teaser | Prime Video,2021-10-09,104949,2411,0,Oct
158,Tingly ASMR Whispers with the Cast of Birds of Paradise | Prime Video,2021-10-09,49276,446,0,Oct
159,I Know What You Did Last Summer – Original Cast Crashes New Cast At NYCC | Prime Video,2021-10-08,61759,538,0,Oct
160,I Know What You Did Last Summer | Exclusive Clip | Prime Video,2021-10-08,61178,280,0,Oct
161,The Wheel Of Time – Winespring Inn Clip | Prime Video,2021-10-08,945177,12794,0,Oct
162,The Expanse Season 6 - Official Teaser | Prime Video,2021-10-08,1001594,22663,0,Oct
163,The Legend of Vox Machina - Title Sequence | Prime Video,2021-10-08,840121,37059,0,Oct
164,The Legend of Vox Machina - NYCC Live Read with Animation | Prime Video,2021-10-08,682709,27840,0,Oct
165,#SHORTS | Seafood Nachos With Danni Rose | Without Remorse,2021-10-07,3996,150,0,Oct
166,The Boys Astrology Theories Podcast Part 2 | Prime Video,2021-10-03,31613,226,0,Oct
167,New to Prime Video US October 2021,2021-10-02,64981,514,0,Oct
168,Justin Bieber: Our World - Official Trailer | Prime Video,2021-10-01,2181687,5357,0,Oct
169,#SHORTS | Very Real Posters with Archey | The Wilds,2021-09-29,2531,80,0,Sep
170,Now Screaming on Prime Video | Prime Video,2021-09-29,15026,370,0,Sep
171,The Voyeurs Cast Plays Caption This | Prime Video,2021-09-28,46907,211,0,Sep
172,#SHORTS | We Animated Dominique Tipper's Dream About Zombies,2021-09-28,7627,193,0,Sep
173,The Boys Mother's Milk Best Scenes Compilation | Prime Video,2021-09-26,23224,497,0,Sep
174,The Boys Astrology Theories Podcast Part 1 | Prime Video,2021-09-25,50094,253,0,Sep
175,The Best of Prime Video Fashion | Making the Cut | Prime Video,2021-09-24,3405,92,0,Sep
176,The Voyeurs Cast Plays Secrets on Set | Prime Video,2021-09-24,57441,431,0,Sep
177,DO RE & MI SING-A-LONG | Maestro Moon Day | Prime Video,2021-09-23,7188,39,0,Sep
178,DO RE & MI SING-A-LONG | I'm Curious | Prime Video,2021-09-23,6697,34,0,Sep
179,"DO RE & MI SING-A-LONG | Rain, Rain, Rain | Prime Video",2021-09-23,14509,48,0,Sep
180,DO RE & MI SING-A-LONG | Best Buggy Blues | Prime Video,2021-09-23,15876,62,0,Sep
181,DO RE & MI SING-A-LONG | Listen To Your Body | Prime Video,2021-09-23,6296,37,0,Sep
182,DO RE & MI SING-A-LONG | Just Won't Quit | Prime Video,2021-09-23,11222,37,0,Sep
183,DO RE & MI SING-A-LONG | Look At Me | Prime Video,2021-09-23,6700,28,0,Sep
184,DO RE & MI SING-A-LONG | Raspberry Cupcakes | Prime Video,2021-09-23,9871,26,0,Sep
185,DO RE & MI SING-A-LONG | Together We're Not Alone | Prime Video,2021-09-23,8702,32,0,Sep
186,DO RE & MI SING-A-LONG | Feathery Friends Day | Prime Video,2021-09-23,9386,35,0,Sep
187,DO RE & MI SING-A-LONG | Happy Hatch-iversary | Prime Video,2021-09-23,4871,24,0,Sep
188,DO RE & MI SING-A-LONG | Shake your Tail Feathers | Prime video,2021-09-23,16186,62,0,Sep
189,I Know What You Did Last Summer – Cast Trailer Reaction | Prime Video,2021-09-23,6074,325,0,Sep
190,I Know What You Did Last Summer - Official Trailer | Prime Video,2021-09-23,4340525,6743,0,Sep
191,The Electrical Life of Louis Wain - Official Trailer | Prime Video,2021-09-23,2197307,6724,0,Sep
192,Savage X Fenty Show - Official Trailer | Prime Video,2021-09-21,369563,2963,0,Sep
193,#SHORTS | Growing ever more fabulous | Everybody's Talking About Jamie,2021-09-20,3249,120,0,Sep
194,Welcome To The Blumhouse LIVE (2021) - Official Trailer | Prime Video,2021-09-20,16346,324,0,Sep
195,Gael Garcia Bernal Best Moments in Mozart in the Jungle | Prime Video,2021-09-19,16487,130,0,Sep
196,Brad Pitt Best Movie Scenes Compilation | Prime Video,2021-09-18,62825,447,0,Sep
197,A Modern Take On The Classic Cinderella Story | Prime Video,2021-09-17,53563,439,0,Sep
198,Change The Narrative | Prime Video,2021-09-17,11083453,244,0,Sep
199,Cinderella Movie Choreographer Interview | Prime Video,2021-09-16,74340,1026,0,Sep
200,Perfect Lyric Video I Cinderella Sing-A-Long I Prime Video,2021-09-15,1348581,37394,0,Sep
201,I Know What You Did Last Summer | Official Teaser | Prime Video,2021-09-15,3822741,2180,0,Sep
202,Evangelion Recap | Anime Club | Prime Video,2021-09-14,55072,463,0,Sep
203,Black As Night - Official Trailer | Prime Video,2021-09-14,276171,1578,0,Sep
204,Madres - Official Trailer | Prime Video,2021-09-14,120682,598,0,Sep
205,The Manor - Official Trailer | Prime Video,2021-09-14,433550,2268,0,Sep
206,Bingo Hell - Official Trailer | Prime Video,2021-09-14,183517,1151,0,Sep
207,DO RE & MI - A Message From the Cast | Prime Video,2021-09-13,3876,92,0,Sep
208,Idina Menzel is Your Dream Girl | Cinderella | Prime Video,2021-09-13,80850,878,0,Sep
209,#SHORTS | We Animated Florence Pugh's Dream About A Bucket,2021-09-13,18573,886,0,Sep
210,Behind the Scenes of Cinderella with Kay Cannon | Cinderella | Prime Video,2021-09-12,85207,782,0,Sep
211,#SHORTS | Very Real Posters with Archey | The Boys,2021-09-10,4559,171,0,Sep
212,Somebody to Love Lyric Video | Cinderella | Prime Video,2021-09-10,614350,10151,0,Sep
213,The Boys | Breaking Down the New Vought Update | Prime Video,2021-09-09,65215,298,0,Sep
214,#SHORTS | Savage x Fenty Show Vol. 3 Coming Soon,2021-09-09,15557,607,0,Sep
215,Encounter - Official Teaser | Prime Video,2021-09-08,540137,4608,0,Sep
216,Birds of Paradise - Official Trailer | Prime Video,2021-09-08,2696028,17754,0,Sep
217,All Or Nothing: Toronto Maple Leafs – Official Trailer | Prime Video,2021-09-08,113425,568,0,Sep
218,Cinderella | Camila Cabello Q&A with Fans I Prime Video,2021-09-02,98861,1600,0,Sep
219,New to Prime Video US September 2021 | Prime Video,2021-09-02,63192,572,0,Sep
220,The Electrical Life of Louis Wain - First Look Clip | Prime Video,2021-09-02,129589,1870,0,Sep
221,The Wheel Of Time – Official Teaser Trailer | Prime Video,2021-09-02,11643632,85770,0,Sep
222,A-Train - Faster (Official Music Video) | The Boys | Prime Video,2021-09-01,950632,13233,0,Sep
223,#SHORTS | Cinderella is coming to Amazon Prime Video September 3,2021-08-31,12178,531,0,Aug
224,#SHORTS | Jimmy O Yang's Recurring Dreams,2021-08-30,14537,617,0,Aug
225,My Name Is Pauli Murray - Official Trailer | Prime Video,2021-08-30,52025,721,0,Aug
226,Modern Love Season 2 Cast Gives Love Advice | Prime Video,2021-08-29,41994,172,0,Aug
227,Stove Top Kisses Cooks A Meal Fit for Michael B. Jordan | Prime Pairings,2021-08-28,67467,1592,0,Aug
228,Goliath Season 4 - Official Trailer | Prime Video,2021-08-25,120351,1247,0,Aug
229,Welcome To The Blumhouse (2021) - Official Teaser Trailer | Prime Video,2021-08-24,1310628,952,0,Aug
230,#Shorts | Rejected Fleabag Poster Art,2021-08-22,5223,154,0,Aug
231,Owen Wilson Movies Now Streaming | Prime Video,2021-08-22,42474,299,0,Aug
232,Panic Cast Behind the Scenes Interview | Prime Video,2021-08-21,53064,760,0,Aug
233,Name a more ineffable duo. You can't. | Good Omens,2021-08-20,5417,290,0,Aug
234,"DO RE & MI | OFFICIAL TRAILER | ON PRIME VIDEO SEPTEMBER 17, 2021",2021-08-19,35360,346,0,Aug
235,The Voyeurs - Official Trailer | Prime Video,2021-08-19,2956723,16048,0,Aug
236,Miles Jai Tries an Asuka Langley Makeup Look | Prime Video,2021-08-18,25227,773,0,Aug
237,LuLaRich - Official Trailer | Prime Video,2021-08-16,484312,3929,0,Aug
238,Sixty Second Summaries | The Expanse Episodes 1 Through 50 | Prime Video,2021-08-15,17849,405,0,Aug
239,The Marvelous Mrs. Maisel | Best Scenes of Abe | Prime Video,2021-08-15,75071,647,0,Aug
240,Modern Love Season 2 – Extended Trailer I Prime Video,2021-08-14,141228,1841,0,Aug
241,The aww couple | Community,2021-08-13,27045,616,0,Aug
242,Twisted Fairy Tales to Watch Now on Prime Video,2021-08-13,118456,1372,0,Aug
243,Cendrillon (Camila Cabello) - Bande-annonce VF | Prime Video,2021-08-13,18438,43,0,Aug
244,Reasons to Watch Evangelion Now with Cheyenne The Geek | Prime Video,2021-08-12,184413,1905,0,Aug
245,Can I pet your dog?! | Legion,2021-08-11,8427,138,0,Aug
246,All Or Nothing: Toronto Maple Leafs – Teaser Trailer | Prime Video,2021-08-11,109015,1050,0,Aug
247,Everybody’s Talking About Jamie - Official Trailer | Prime Video,2021-08-10,4042301,2402,0,Aug
248,Sarah Pidgeon's Craziest Dream | The Wilds,2021-08-09,5352,192,0,Aug
249,Vought Unveils New YouTube Channel | The Boys | Prime Video,2021-08-08,62742,825,0,Aug
250,Astrology Analysis of The Marvelous Mrs. Maisel Characters | Prime Video,2021-08-07,290463,750,0,Aug
251,Packing for my first vacation in a year like: | The Marvelous Mrs. Maisel x Doja Cat,2021-08-06,6749,109,0,Aug
252,Friend Families You Want to Be A Part Of | Prime Video,2021-08-06,49137,321,0,Aug
253,Where'd you get your coat? | The Tomorrow War,2021-08-04,3973,104,0,Aug
254,Annette - Final Trailer | Prime Video,2021-08-04,1038427,1622,0,Aug
255,Cinderella - Official Trailer | Prime Video,2021-08-03,14454546,161601,0,Aug
256,Sixty Second Summaries | The Marvelous Mrs. Maisel Episode 1 | Prime Video,2021-08-02,17822,168,0,Aug
257,New To Prime Video US in August 2021 | Prime Video,2021-08-01,65264,488,0,Aug
258,Best 2-for-1 Acting Performances | Prime Video,2021-07-31,54560,484,0,Jul
259,What I wanted v. what I got | Fleabag | #whatiwantedvswhatigot,2021-07-30,5754,152,0,Jul
260,Sixty Second Summaries | Fleabag Episode 1 | Prime Video,2021-07-30,4102,145,0,Jul
261,Chester Lockhart Hottest Villains Countdown | Prime Video,2021-07-30,59587,407,0,Jul
262,You’ve got something in your teeth | The Boys,2021-07-29,7964,276,0,Jul
263,Seth Rogen Best Movie Scenes Compilation | Prime Video,2021-07-28,55251,237,0,Jul
264,Abe don’t need permission to dance | #BTS #PermissionToDance,2021-07-27,4267,145,0,Jul
265,BREAKING: Rampaging beast DESTROYS harmless date; SHATTERS fourth wall | Fleabag,2021-07-26,8083,212,0,Jul
266,The Marvelous Mrs Maisel | Funniest Stand Up Comedy Scenes Compilation | Prime Video,2021-07-25,667644,5190,0,Jul
267,Ok y'all are we fightin or flightin | The Tomorrow War,2021-07-24,4381,124,0,Jul
268,Chris Pratt and The Tomorrow War Cast Predict the Future | Prime Video,2021-07-24,52416,250,0,Jul
269,Doug Jones Best Performances | Prime Video,2021-07-23,57607,357,0,Jul
270,Nine Perfect Strangers – Official Trailer 2 | Prime Video,2021-07-22,2493,26,0,Jul
271,Sixty Second Summaries | Carnival Row Episode 1 | Prime Video,2021-07-21,6863,149,0,Jul
272,The Take Explains Bosch Series Finale Explained | Prime Video,2021-07-20,53053,439,0,Jul
273,The Tomorrow War cast spills the tea,2021-07-18,6541,249,0,Jul
274,Cara Delevingne Movies and Shows Streaming Now | Prime Video,2021-07-18,51689,434,0,Jul
275,The Tomorrow War Cast Plays Would You Rather | Prime Video,2021-07-17,40931,227,0,Jul
276,It's kind of a long story... | The Tomorrow War,2021-07-16,5042,143,0,Jul
277,Comfort Food Recipes to Cook While Watching Panic | Prime Pairings,2021-07-16,56600,630,0,Jul
278,The Boys Got 5 Emmy Nominations!,2021-07-15,9397,443,0,Jul
279,Modern Love Season 2 - Official Trailer | Prime Video,2021-07-15,3836728,14079,0,Jul
280,When the ice cream machine at McDonald's is broken YET AGAIN | Jolt,2021-07-14,12726,307,0,Jul
281,The Tomorrow War Cast Plays Guess The Question | Prime Video,2021-07-13,51674,265,0,Jul
282,Toofaan (The Storm) - Official Trailer | Prime Video,2021-07-12,21862,569,0,Jul
283,The Tomorrow War Cast Loves Each Other | Prime Video,2021-07-11,154244,536,0,Jul
284,We all have that one friend who's secretly ripped | The Tomorrow War | #Shorts,2021-07-10,12189,457,0,Jul
285,The Tomorrow War Ending Explained  | The Takeaway | Prime Video,2021-07-10,137851,974,0,Jul
286,5 Ways to Watch JK Simmons | Prime Video,2021-07-09,48831,290,0,Jul
287,Time Travel in The Tomorrow War  | Prime Video,2021-07-08,187661,754,0,Jul
288,Laser eyes | Group Chat | #Shorts,2021-07-07,5219,72,0,Jul
289,The Boys vs. Invincible Fans Debate | Prime Video,2021-07-07,192862,1855,0,Jul
290,"Tiny hands, big heart :( | The Marvelous Mrs. Maisel | #Shorts",2021-07-06,16720,183,0,Jul
