,Title,Published_date,Views,Likes,Favourite,Month
291,VAL | Official Trailer | Prime Video,2021-07-06,2378196,8955,0,Jul
292,Emma Stone Movies to Watch on Prime Video July 2021,2021-07-05,106037,557,0,Jul
293,Chris Pratt in The Tomorrow War - Behind the Scenes Exclusive | Prime Video,2021-07-04,173570,848,0,Jul
294,Chester Lockhart Ranks the Steamiest Scenes to Stream | Prime Video,2021-07-03,9686,122,0,Jul
295,3 Ways To Watch Chris Pratt Now | Prime Video,2021-07-02,104707,813,0,Jul
296,The cats versus dogs debate rages on | Truth Seekers | #Shorts,2021-07-01,6236,161,0,Jul
297,New To Prime Video US July 2021 | Prime Video,2021-07-01,59890,462,0,Jul
298,EVANGELION: 3.0+1.01 THRICE UPON A TIME - Official Trailer | Prime Video,2021-07-01,1686447,60966,0,Jul
299,Iconic Queer Movies and Shows Panel Discussion | Prime Video,2021-06-30,55107,361,0,Jun
300,Cinderella – Official First Look I Prime Video,2021-06-30,670284,26032,0,Jun
301,The Wheel Of Time – Motion Title Treatment | Prime Video,2021-06-30,248065,5888,0,Jun
302,Savage x Fenty | Empowerment of Drag | #Shorts,2021-06-29,4102,113,0,Jun
303,JOLT - Official Trailer | Prime Video,2021-06-29,2536940,15201,0,Jun
304,The Wilds | Shoni Wedding Cake Topper Fan Art | Prime Video,2021-06-29,9067,243,0,Jun
305,Watch Rank'd now on Prime Video | #Shorts,2021-06-28,2470,59,0,Jun
306,Ru Paul's Drag Race Best Looks Countdown With Chester Lockhart | Prime Video,2021-06-28,42814,191,0,Jun
307,4 Ways To Watch Barry Jenkins | Prime Video,2021-06-27,197024,708,0,Jun
308,The Wilds | Queer Moments and Kisses | Prime Video,2021-06-26,32634,544,0,Jun
309,"That bi lighting, though... | Neon Demon | #Shorts",2021-06-25,6322,184,0,Jun
310,BORAT Learns to Golf | Prime Video,2021-06-25,93998,931,0,Jun
311,4 Ways To Experience Zachary Quinto | Prime Video,2021-06-24,43498,254,0,Jun
312,The Pursuit of Love - Official Trailer | Prime Video,2021-06-23,123002,745,0,Jun
313,Drop Dead Gorgeous | Most Iconic Death Drops | RuPaul's Drag Race | #Shorts,2021-06-22,9846,223,0,Jun
314,Annette - Official Trailer | Prime Video,2021-06-22,1116875,9385,0,Jun
315,Luxe Listings Sydney - Official Trailer | Prime Video,2021-06-21,42242,238,0,Jun
316,Most Romantic Pride Moments | Prime Video,2021-06-20,10504,288,0,Jun
317,Today we celebrate Black creators | Happy Juneteenth | #Shorts,2021-06-19,2584,98,0,Jun
318,Building the Underground Railroad | Prime Video,2021-06-18,58733,225,0,Jun
319,Breaking Down The Handmaiden | In the Stars | Prime Video,2021-06-17,91965,338,0,Jun
320,H.E.R. knows you're a star | Prime Day Concert | #Shorts,2021-06-17,7501,211,0,Jun
321,Kid Cudi said it best - this is just the right vibe | Prime Video,2021-06-17,16891,673,0,Jun
322,The Ultimate Sci Fi Gadgets | Rank'd | Prime Video,2021-06-16,79291,308,0,Jun
323,Actually *I* mind. | Uncle Frank | #Shorts,2021-06-15,4431,192,0,Jun
324,La Guerre de Demain - Bande-annonce 2 | Prime Video,2021-06-15,19861,44,0,Jun
325,THE TOMORROW WAR | Final Trailer | Prime Video,2021-06-15,7729427,20452,0,Jun
326,The element of surpri--BLUEBERRY NO | My Spy | #Shorts,2021-06-14,4289,202,0,Jun
327,Ru Paul’s Drag Race Iconic Reads | Prime Video,2021-06-14,90885,297,0,Jun
328,Who keeps those in the same file??? | Upload | #Shorts,2021-06-13,5247,186,0,Jun
329,Queer Anime to Watch on Prime Video | Anime Club | Prime Video,2021-06-13,467989,10296,0,Jun
330,Coat | Tom Walker | #Shorts,2021-06-12,4482,148,0,Jun
331,Starlight - Never Truly Vanish (Official Music Video) | Prime Video,2021-06-12,876465,11157,0,Jun
332,"He's wearing a turtleneck and a blazer, I don't know what you expected to happen | Fleabag | #Shorts",2021-06-11,10761,341,0,Jun
333,4 Ways To Experience Vince Vaughn on Prime | Prime Video,2021-06-11,85335,388,0,Jun
334,Nine Perfect Strangers – Official Trailer | Prime Video,2021-06-11,13264,85,0,Jun
335,Send your crush your favorite words and tell us what they say back. | The Wilds,2021-06-10,4745,160,0,Jun
336,Panic Season 1 Ending Explained | The Takeaway | Prime Video,2021-06-10,138506,658,0,Jun
337,We just want pockets...Why is this so hard to grasp?,2021-06-09,8261,445,0,Jun
338,Making the Cut | Season 2 Official Trailer | Prime Video,2021-06-09,1779804,395,0,Jun
339,Are you chillin with your demons? | Prime Video,2021-06-08,3733,263,0,Jun
340,Brainwashing Isn't All That Bad! | The Wilds,2021-06-07,5296,206,0,Jun
341,Why Do They REALLY Put Erasers on The Ends of Pencils? | Fleabag,2021-06-06,10478,502,0,Jun
342,Peggy Olson in Mad Men Brings Up Feelings in Group Chat | Prime Video,2021-06-06,114968,366,0,Jun
343,"Upload Complete, Now What?! | Upload",2021-06-05,25124,553,0,Jun
344,Raja Kumari Tests Her Bollywood Knowledge | Prime Video,2021-06-05,124406,520,0,Jun
345,We're All in Denial About Something! | The Marvelous Mrs. Maisel,2021-06-04,16257,325,0,Jun
346,"Don't try to act cool, you'd panic...wouldn't you? | Panic",2021-06-04,3063,94,0,Jun
347,New To Prime Video US in June 2021 | Prime Video,2021-06-03,106137,662,0,Jun
348,What does it mean to be a teenager? | Chemical Hearts,2021-06-02,5171,258,0,Jun
349,FLACK S2 - Official Trailer | Prime Video,2021-06-02,51952,540,0,Jun
350,BOSCH Season 7 - Official Trailer | Prime Video,2021-06-02,241069,3495,0,Jun
351,Mary J Blige's My Life - Official Trailer | Prime Video,2021-06-01,386407,11286,0,Jun
352,Jayde Adams Has Thoughts on The Kylie Lip Kit!,2021-05-31,16391,717,0,May
353,Jackie Chan's Best Fight Scenes | Prime Video,2021-05-31,192629,3128,0,May
354,How Pink's Mom Inspired Her Career,2021-05-30,7455,240,0,May
355,Making J Balvin Inspired Custom Grillz with Christy Cash | Cut The Craft | Prime Video,2021-05-30,3974,125,0,May
356,Invincible ASMR Mukbang with Zach Choi | Prime Video,2021-05-29,14616,621,0,May
357,Invincible ASMR Mukbang with Zach Choi | Prime Video,2021-05-29,3457212,44810,0,May
358,"Sit back, freak out and binge watch Panic season 1!",2021-05-28,4914,125,0,May
359,Groundbreaking Asian Narratives in Movies | Group Chat | Prime Video,2021-05-28,2087,64,0,May
360,September Mornings - Official Trailer | Prime Video,2021-05-27,33802,452,0,May
361,3 Alia Shawkat Movies To Watch Now | Prime Video,2021-05-27,48761,174,0,May
362,THE TOMORROW WAR | Official Trailer | Prime Video,2021-05-26,11177402,49744,0,May
363,Tony Shalhoub Stan Cam | Prime Video,2021-05-24,6276,153,0,May
364,F Murray Abraham Movies To Watch Now | Prime Video,2021-05-23,47338,214,0,May
365,Throw An Axe Like Your Favorite Vikings Characters | Prime Video,2021-05-22,27028,267,0,May
366,Funniest Asian Pacific American Comedian Highlights | Prime Video,2021-05-21,4474,125,0,May
367,The Wilds: Dot is the Ultimate Earth Sign | In the Stars Podcast | Prime Video,2021-05-20,52901,197,0,May
368,Everybody’s Talking About Jamie – Release Date Announcement I Prime Video,2021-05-20,31008,513,0,May
369,Coming 2 America - Behind the Score Featurette | Prime Video,2021-05-20,61765,214,0,May
370,Jet Li's Best Fights | Prime Video,2021-05-19,65990,888,0,May
371,J Balvin Stan Cam | Prime Video,2021-05-18,53078,415,0,May
372,Comedy Movies on Prime Video | Group Chat,2021-05-17,47127,238,0,May
373,Gillian Jacobs and Robert Kirkman of Invincible React To Fan Comments | Prime Video,2021-05-16,412508,11470,0,May
374,Smashing Asian Pacific American Stereotypes | Prime Video,2021-05-15,80607,1796,0,May
375,"A Conversation with Barry Jenkins, Thuso Mbedu, and Ta-Nehisi Coates | Prime Video",2021-05-14,54832,310,0,May
376,Los Colores De Colombia | The Boy From Medellín | Prime Video,2021-05-13,54195,240,0,May
377,BOSCH Season 7 - Official Teaser | Prime Video,2021-05-13,130957,1403,0,May
378,Thank You For 1 Million Subscribers!,2021-05-12,4740,231,0,May
379,PANIC - Official Trailer | Prime Video,2021-05-12,8224410,8528,0,May
380,PINK All I Know So Far - Official Trailer | Prime Video,2021-05-11,153816,2051,0,May
381,DOM - Official Trailer | Prime Video,2021-05-11,334206,3742,0,May
382,Is David Tennant a Sagittarius in Good Omens? | In The Stars | Prime Video,2021-05-10,58681,376,0,May
383,SOLOS - Trailer | Prime Video,2021-05-10,624246,9315,0,May
384,Without Remorse - Operation Drone Drop | Prime Video,2021-05-09,99483,438,0,May
385,Prime Pairings with Danni Rose - The Boys | Prime Video,2021-05-08,207727,1790,0,May
386,Jimmy O. Yang Rewards You With A Joke,2021-05-07,14657,801,0,May
387,Anime Club: Best Girls | Prime Video,2021-05-07,79371,1843,0,May
388,Lucy Liu Stan Cam | Prime Video,2021-05-06,182008,1843,0,May
389,I Am José | The Boy From Medellín | Prime Video,2021-05-04,55969,348,0,May
390,Celebrating APAHM with Prime Video #Shorts,2021-05-03,3975,174,0,May
391,Invincible Celebrity Cameos You Don't Want To Miss | Prime Video,2021-05-03,231353,5824,0,May
392,Trippiest Movies | Weekly Watchlist | Prime Video,2021-05-02,72670,558,0,May
393,New to Prime Video US in May 2021 | Prime Video,2021-05-01,114990,647,0,May
394,Military Training - Without Remorse | Prime Video,2021-04-30,91728,1461,0,Apr
395,DOM - Official Teaser | Prime Video,2021-04-29,13817,297,0,Apr
396,Actor on Actor - Without Remorse | Prime Video,2021-04-29,809782,16779,0,Apr
397,Eyes on the Target - Burning Car | Without Remorse | Prime Video,2021-04-28,65502,624,0,Apr
398,The Wheel Of Time – Lan | Prime Video,2021-04-28,212109,2695,0,Apr
399,La Guerre de Demain - Bande-annonce | Prime Video,2021-04-28,4086,25,0,Apr
400,Eyes on the Target - Prison Fight | Without Remorse | Prime Video,2021-04-28,702792,6306,0,Apr
401,THE TOMORROW WAR | First Look Tease | Prime Video,2021-04-28,1777236,5821,0,Apr
402,Sound of Metal: Teaser Trailer | Prime Video #Shorts,2021-04-28,6228,212,0,Apr
403,Without Remorse Drone Drop Announcement | Prime Video,2021-04-27,54957,386,0,Apr
404,Classic Rocker Stan Cam | Prime Video,2021-04-27,56975,310,0,Apr
405,The Boy From Medellín - Official Trailer | Prime Video,2021-04-26,1651453,1500,0,Apr
406,Best Psychological Thrillers | Weekly Watchlist | Prime Video,2021-04-25,7510,192,0,Apr
407,THEM - Behind The Music with Little Marvin | Prime Video,2021-04-24,68330,200,0,Apr
408,Oscar Worthy Moments from Sound of Metal | Prime Video,2021-04-23,70490,840,0,Apr
409,Ten Reasons Sharks Need Us Now More Than Ever | Prime Video,2021-04-22,94665,481,0,Apr
410,THEM - Redlining Explained | Prime Video,2021-04-22,6162,141,0,Apr
411,The Expanse Season 5 | Nemesis Games Book to Screen - Episode 510,2021-04-21,96455,320,0,Apr
412,Dazed and Confused Iconic Lines | Prime Video,2021-04-20,111273,1638,0,Apr
413,Maradona: Blessed Dream - Teaser Trailer | Prime Video,2021-04-19,38740,853,0,Apr
414,THEM - This Season | Prime Video,2021-04-18,15038,277,0,Apr
415,Movie Snacks Fit for Coming 2 America Royalty - Prime Pairings | Prime Video,2021-04-17,294349,1983,0,Apr
416,Made For Love – Official Trailer | Prime Video,2021-04-16,3332,36,0,Apr
417,Frank of Ireland - SPEED | Prime Video,2021-04-16,137278,1378,0,Apr
418,Borat Supplemental Reportings - Official Trailer | Prime Video,2021-04-15,1467713,2650,0,Apr
419,Underground Railroad - Bande-annonce | Prime Video,2021-04-15,222,17,0,Apr
420,The Underground Railroad - Official Trailer | Prime Video,2021-04-15,4928920,7402,0,Apr
421,New to Prime Video Canada in April 2021 | Prime Video,2021-04-14,1072,21,0,Apr
422,The Expanse Season 5 | Nemesis Games Book to Screen - Episode 509,2021-04-14,4793,155,0,Apr
423,TIME | Watch Now on Prime Video,2021-04-13,135053,105,0,Apr
424,Without Remorse - Tom Clancy Social Featurette | Prime Video,2021-04-12,35247,536,0,Apr
425,4 Ways To Watch Kristen Wiig | Prime Video,2021-04-11,49945,253,0,Apr
426,Understanding the “Tap Dance Man” with Ashley Thomas - THEM | Prime Video,2021-04-10,931470,15106,0,Apr
427,Becoming Betty with Alison Pill - THEM | Prime Video,2021-04-10,112563,1291,0,Apr
428,Building a Family with the Cast of THEM | Prime Video,2021-04-10,45739,587,0,Apr
429,The Weight on Henry’s Shoulders with Ashley Thomas - THEM | Prime Video,2021-04-09,55895,350,0,Apr
430,Lucky’s Story Comes to Life with Deborah Ayorinde - THEM | Prime Video,2021-04-09,77015,647,0,Apr
431,An Introduction to THEM with Little Marvin | Prime Video,2021-04-09,180326,1011,0,Apr
432,The Expanse Season 5 | Nemesis Games Book to Screen - Episode 508,2021-04-07,51169,234,0,Apr
433,Sans aucun remords - Bande-annonce | Prime Video,2021-04-06,14489,48,0,Apr
434,Without Remorse - Final Trailer | Prime Video,2021-04-06,22401010,14254,0,Apr
435,3 M. Night Shyamalan Movies To Watch Now | Prime Video,2021-04-04,11723,125,0,Apr
436,Katara's 7 Best Moments in Avatar the Last Airbender | Prime Video,2021-04-03,632679,7001,0,Apr
437,Criss Angel - Best Mindfreaks | Prime Video,2021-04-02,28057,254,0,Apr
438,New to Prime Video US in April 2021 | Prime Video,2021-04-01,110365,512,0,Apr
439,The Expanse Season 5 | Nemesis Games Book to Screen - Episode 507,2021-03-31,56040,375,0,Mar
440,Top 8 Sci-Fi Women | Prime Video,2021-03-30,49273,321,0,Mar
441,4 Whoopi Goldberg Movies to Watch Now | Prime Video,2021-03-29,63890,304,0,Mar
442,4 Wes Anderson Movies to Watch Now | Prime Video,2021-03-28,51543,282,0,Mar
443,The Wilds: Are Toni and Shelby an Astrological Match? | In The Stars,2021-03-27,119379,1286,0,Mar
444,Best Science Fiction Shows and Movies to Watch on Prime Video | Weekly Watchlist,2021-03-26,70223,365,0,Mar
445,Stowaway – Official Trailer | Prime Video,2021-03-25,10310,89,0,Mar
446,Frank of Ireland - Official Trailer | Prime Video,2021-03-25,146493,1015,0,Mar
447,People React To That Scene From INVINCIBLE | Prime Video,2021-03-24,469490,6691,0,Mar
448,The Expanse Season 5 | Nemesis Games Book to Screen - Episode 506,2021-03-23,55243,290,0,Mar
449,THEM - Official Trailer | Prime Video,2021-03-22,1895901,21666,0,Mar
450,Coming 2 America | Tufting Eddie Murphy | Prime Video,2021-03-21,60368,245,0,Mar
451,Best Spin Kicks from Alias | Prime Video,2021-03-20,51246,397,0,Mar
452,Coming 2 America Cast Plays Which Character Are You? | Prime Video,2021-03-19,97648,904,0,Mar
453,THEM - Can't You See Her? | Prime Video,2021-03-18,892989,5169,0,Mar
454,Devilish Dames and Scream Queens on Prime Video | Prime Video,2021-03-18,10484,122,0,Mar
455,The Expanse Season 5 - Making of Episode 501 Amos Shower Fight Scene,2021-03-17,91126,537,0,Mar
456,The Wheel of Time – Moiraine | Prime Video,2021-03-17,334867,3375,0,Mar
457,The Expanse Season 5 | Nemesis Games Book to Screen - Episode 505,2021-03-17,65935,293,0,Mar
458,THEM - Mold on Wallpaper | Prime Video,2021-03-16,18621,236,0,Mar
459,THEM - Painted White | Prime Video,2021-03-16,27661,353,0,Mar
460,THEM - Down the Hallway | Prime Video,2021-03-16,130400,772,0,Mar
461,THEM - Hair on Fire | Prime Video,2021-03-16,1435076,12100,0,Mar
462,Best of Andy Allo as Nora in Upload Season 1 | Prime Video,2021-03-15,6420,189,0,Mar
463,Badass Women to Watch on Prime Video | Weekly Watchlist | Prime Video,2021-03-14,811725,2100,0,Mar
464,Made Up With Miles Jai - The Map of Tiny Perfect Things | Prime Video,2021-03-13,87542,454,0,Mar
465,Sonic Stan Cam | Prime Video,2021-03-12,11422,227,0,Mar
466,Johnny Mnemonic 2021 Predictions | Prime Video,2021-03-11,71537,586,0,Mar
467,The Expanse Season 5 | Nemesis Games Book to Screen - Episode 504,2021-03-10,101897,333,0,Mar
468,THEM – Official Teaser | Prime Video,2021-03-09,2631925,5328,0,Mar
469,4 Ways to Watch Lily Rabe | Prime Video,2021-03-08,5713,164,0,Mar
470,Coming 2 America Play Set | Prime Video,2021-03-07,183247,1434,0,Mar
471,The Wilds Season 1 Blooper Reel | Prime Video,2021-03-06,181476,8499,0,Mar
472,Recap Coming to America Before You Watch Coming 2 America | Prime Video,2021-03-05,132997,1204,0,Mar
473,The Map of Tiny Perfect Things | I Have to Go,2021-03-04,55592,333,0,Mar
474,Sans aucun remords - Bande-annonce | Prime Video,2021-03-04,4505,28,0,Mar
475,Coming 2 America - The Royal Family Has Arrived,2021-03-03,823903,942,0,Mar
476,Without Remorse - Official Trailer | Prime Video,2021-03-03,9805552,37539,0,Mar
477,The Expanse Season 5 | Nemesis Games Book to Screen - Episode 503,2021-03-03,323083,414,0,Mar
478,4 Ways to Watch Ben Stiller | Prime Video,2021-03-02,87412,417,0,Mar
479,New to Prime Video US in March 2021 | Prime Video,2021-03-01,281029,625,0,Mar
480,Change The Narrative | Prime Video,2021-03-01,13619068,2586,0,Mar
481,Thoughtful Gestures in The Map of Tiny Perfect Things | Prime Video,2021-02-28,59806,455,0,Feb
482,Contemporary Black Cinema | Weekly Watchlist | Prime Video,2021-02-27,31409,163,0,Feb
483,Tell Me Your Secrets - Top 5 Freak Outs | Prime Video,2021-02-26,24285,399,0,Feb
484,The Underground Railroad - Official Teaser Trailer,2021-02-25,3298858,1268,0,Feb
485,The Expanse Season 5 | Nemesis Games Book to Screen - Episode 502,2021-02-24,238271,465,0,Feb
486,Ryan Gosling Stan Cam | Prime Video,2021-02-23,94131,373,0,Feb
487,The Map of Tiny Perfect Things | Astaire Walk,2021-02-22,7764,181,0,Feb
488,Kimiko and Frenchie from The Boys are Relationship Goals | Prime Video,2021-02-21,160053,2217,0,Feb
489,One Night In Miami...Fact Check | Prime Video,2021-02-20,14135,189,0,Feb
490,The Map of Tiny Perfect Things Cast Plays Unbox the Plot,2021-02-19,10674,362,0,Feb
491,Invincible – Official Trailer | Prime Video,2021-02-19,3028493,66032,0,Feb
492,The Wilds Cast Plays What's in My Bag | Prime Video,2021-02-18,168843,7220,0,Feb
493,The Expanse Season 5 | Nemesis Games Book to Screen - Episode 501,2021-02-17,16852,580,0,Feb
494,The Map Of Tiny Perfect Things Ending Explained | The Takeaway | Prime Video,2021-02-16,23287,621,0,Feb
495,The Wilds Inspired Miles Jai Makeup | Prime Video,2021-02-15,1390885,6525,0,Feb
496,Top 5 Black Romance Movies from the 90s | Prime Video,2021-02-14,167853,1428,0,Feb
497,Regina King on Directing One Night in Miami... | Prime Video,2021-02-13,4582,146,0,Feb
498,Best Asian Language Cinema | Weekly Watchlist | Prime Video,2021-02-12,27445,196,0,Feb
499,The Map of Tiny Perfect Things | Boys Are So Weird,2021-02-12,17081,255,0,Feb
500,Prime Video | Valentine's Day,2021-02-12,1396,44,0,Feb
501,Randy Watson’s Sexual Chocolate,2021-02-11,55868,756,0,Feb
502,The Expanse - Season 5 Blooper Reel,2021-02-10,117265,3878,0,Feb
503,The Map of Tiny Perfect Things | Math Nerd,2021-02-09,10291,210,0,Feb
504,Movie Meet Cutes | Prime Video,2021-02-09,7062,94,0,Feb
505,The Map of Tiny Perfect Things | Car Thief,2021-02-09,5799,173,0,Feb
506,Dating 101: Tips from Turk and Carla from Scrubs | Prime Video,2021-02-08,9520,273,0,Feb
507,Coming 2 America Big Game Spot: The Return,2021-02-08,83132,566,0,Feb
508,Valentine's Day Movies For One | Weekly Watchlist | Prime Video,2021-02-07,3803,127,0,Feb
509,Bernie Mac is Hilarious in The Bernie Mac Show | Prime Video,2021-02-06,41557,377,0,Feb
510,A Trio of Ways To Watch Eddie Murphy | Prime Video,2021-02-05,6228,161,0,Feb
511,The Map of Tiny Perfect Things | Stealth Date,2021-02-05,6450,183,0,Feb
512,"The Expanse Aftershow Season 5 Episode 10: Wes Chatham, Ty Franck, Dominique Tipper & Steven Strait",2021-02-04,199254,8510,0,Feb
513,The Expanse Season 5 Ending Explained | The Takeaway | Prime Video,2021-02-04,105489,3290,0,Feb
514,Coming 2 America Official Trailer #2 | Prime Video,2021-02-03,21976556,30479,0,Feb
515,Dexter Stan Cam | Prime Video,2021-02-02,5388,202,0,Feb
516,Now Streaming on Prime Video US February 2021 | Prime Video,2021-02-01,9204,233,0,Feb
517,Sundance Film Festival Favorites | Weekly Watchlist | Prime Video,2021-01-30,52506,540,0,Jan
518,"BLISS - ""YOU AND I"" by Will Bates featuring Skye Edwards | Prime Video",2021-01-29,20080,878,0,Jan
519,4 Ways To Watch Janelle Monae | Prime Video,2021-01-28,5314,413,0,Jan
520,The Map of Tiny Perfect Things - Official Trailer,2021-01-27,5473962,18855,0,Jan
521,Tell Me Your Secrets Season 1 - Official Trailer | Prime Video,2021-01-27,4573242,1317,0,Jan
522,"The Expanse Aftershow Season 5 Episode 9: Wes Chatham, Ty Franck & Nadine Nicole",2021-01-27,131792,5678,0,Jan
523,Eve's Most Savage Moments From Flack | Prime Video,2021-01-25,12576,195,0,Jan
524,It's A Sin –  Official Trailer | Prime Video,2021-01-25,6606,77,0,Jan
525,Meet the Characters from Flack | Prime Video,2021-01-24,7546,113,0,Jan
526,Best Coming of Age Movies | Weekly Watchlist | Prime Video,2021-01-23,14219,167,0,Jan
527,Invincible – First Look Clip | Prime Video,2021-01-22,700755,15712,0,Jan
528,Janelle Monáe performs “Turntables” from All In: The Fight for Democracy,2021-01-22,15950,623,0,Jan
529,Relationship Timeline of Toni and Shelby from The Wilds | Prime Video,2021-01-21,264849,7052,0,Jan
530,"The Expanse Aftershow Season 5 Episode 8: Wes Chatham, Ty Franck & Daniel Abraham",2021-01-20,162252,4432,0,Jan
531,Greenland | Prime Video,2021-01-19,71035,132,0,Jan
532,Tiffany Haddish Will Make You Laugh | Prime Video,2021-01-18,6293,104,0,Jan
533,Best Music Movies on Prime Video | Weekly Watchlist,2021-01-17,11488,174,0,Jan
534,Awkward Questions With The Wilds Cast | Prime Video,2021-01-16,355351,14528,0,Jan
535,One Night in Miami | Meet the Characters | Prime Video,2021-01-15,13070,279,0,Jan
536,FLACK S1 | Official Trailer,2021-01-15,193352,1440,0,Jan
537,Rachel Brosnahan Has Amazing Range | Prime Video,2021-01-14,18259,225,0,Jan
538,The Map of Tiny Perfect Things | Meet Cute,2021-01-14,77348,496,0,Jan
539,"The Expanse Aftershow Season 5 Episode 7: Wes Chatham, Ty Franck & Dominique Tipper",2021-01-13,104856,4536,0,Jan
540,Bliss - Official Trailer (2021) | Prime Video,2021-01-12,4219395,11229,0,Jan
541,Wayne Stan Cam | Prime Video,2021-01-12,6733,222,0,Jan
542,The Janitor From Scrubs Funniest Moments | Prime Video,2021-01-11,17831,354,0,Jan
543,Sylvie's Love | Best Musical Moments | Prime Video,2021-01-10,7600,127,0,Jan
544,The Expanse Cast Shares Their Craziest Dreams | Prime Video,2021-01-09,18549,834,0,Jan
545,The Wilds Actors Give A Set Tour | Prime Video,2021-01-08,1148650,14432,0,Jan
546,Vampire Movies | Weekly Watchlist | Prime Video,2021-01-07,12892,189,0,Jan
547,"The Expanse Aftershow Season 5 Episode 6: Wes Chatham, Ty Franck, Cara Gee & Keon Alexander",2021-01-06,275923,9559,0,Jan
548,Robert Pattinson Stan Cam | Prime Video,2021-01-05,10496,294,0,Jan
549,One Night in Miami... | Official Trailer,2021-01-04,758215,6993,0,Jan
550,Welcome to Prime Video 2021,2021-01-03,261034,1825,0,Jan
551,Ruben Stan Cam | Sound of Metal | Prime Video,2021-01-02,7650,133,0,Jan
552,Now Streaming on Prime Video US January 2021 | Prime Video,2021-01-01,31522,350,0,Jan
553,YEARLY DEPARTED — F2020 Behind-The-Scenes Video | Prime Video,2020-12-31,530017,304,0,Dec
554,The Expanse - 50 episodes in 50 seconds,2020-12-31,31821,900,0,Dec
555,"The Expanse Aftershow Season 5 Episode 5: Wes Chatham, Ty Franck, Jasai Chase Owens & Jeff Woolnough",2020-12-30,93028,4381,0,Dec
556,Schitt Happens 2020 | Prime Video,2020-12-29,9233,205,0,Dec
557,Chilling Winter Movies | Prime Video,2020-12-28,11779,162,0,Dec
558,Headphones On: The Sound Design in Sound of Metal,2020-12-27,38929,877,0,Dec
559,The Expanse | Shohreh Aghdashloo Helps You Sleep Peacefully | Prime Video,2020-12-26,49461,2039,0,Dec
560,Prime Video | Cheer Starts Here | Happy Holidays 2020,2020-12-24,19102,348,0,Dec
561,"The Expanse Aftershow Season 5 Episode 4 - Wes Chatham, Ty Franck, Shohreh Aghdashloo, and Dan Nowak",2020-12-23,196050,6198,0,Dec
562,NFL Blitz: Hurry Up Kitchen with Action Bronson,2020-12-22,13105,213,0,Dec
563,Coming 2 America - Official Trailer,2020-12-22,16713613,148546,0,Dec
564,Best Holiday Date Movies | Prime Video,2020-12-21,7088,157,0,Dec
565,Holiday Movie Deep Cuts Trivia | Prime Video,2020-12-20,3119,53,0,Dec
566,In Conversation: FoxandRob and Kier & Noémie Gaines on TIME,2020-12-20,5109,115,0,Dec
567,The Wilds Cast Plays Don't @ me | Prime Video,2020-12-19,424772,10317,0,Dec
568,Unbox the Plot | The Expanse | Prime Video,2020-12-19,1759002,1329,0,Dec
569,Natasha Leggero Reads Goodbye 2020 | Yearly Departed Comedy Special,2020-12-17,678635,490,0,Dec
570,"The Expanse Aftershow Season 5, Episode 3 - Wes Chatham, Ty Franck, and Thomas Jane",2020-12-16,152149,4671,0,Dec
571,"The Expanse Aftershow Season 5, Episode 2 - Wes Chatham, Ty Franck, Steven Strait, & Breck Eisner",2020-12-16,142152,4255,0,Dec
572,"The Expanse Aftershow Season 5, Episode 1 - Wes Chatham, Ty Franck, & Naren Shankar",2020-12-16,1300910,5783,0,Dec
573,Meet the Cast of The Wilds | Prime Video,2020-12-15,363877,9633,0,Dec
574,YEARLY DEPARTED – Official Trailer – New Comedy Special | Prime Video,2020-12-14,2071735,1224,0,Dec
575,Best Outfits from The Kacey Musgraves Christmas Show | Prime Video,2020-12-13,10074,116,0,Dec
576,The Wilds | Meet The Characters | Prime Video,2020-12-12,168362,1865,0,Dec
577,Introducing The Expanse Aftershow with Wes Chatham and Ty Franck of James S.A. Corey,2020-12-10,23175,966,0,Dec
578,Palm Springs – Exclusive Trailer | Prime Video,2020-12-09,16346,48,0,Dec
579,Alex Wheatle Exclusive Clip | Small Axe,2020-12-09,6372,76,0,Dec
580,The Cast of The Expanse Reads Fan Tweets | Prime Video,2020-12-09,593596,3300,0,Dec
581,The Expanse | Most Savage Moments of Avasarala | Prime Video,2020-12-08,271076,6026,0,Dec
582,Herself Official Trailer (2021) | Prime Video,2020-12-08,661464,1475,0,Dec
583,Sylvie’s Love Official Trailer | Premieres on December 23rd,2020-12-08,1685409,254,0,Dec
584,Jim Gaffigan Stand-Up Special | The Pale Tourist  | Prime Video,2020-12-07,13988,122,0,Dec
585,Small Axe | Education Trailer | Prime Video,2020-12-07,19074,227,0,Dec
586,The Expanse Exclusive Clip | Amos and Chrissy,2020-12-07,86431,2294,0,Dec
587,Top 10 Savage X Fenty Vol. 2 Moments Rated By Denzel Dion | Prime Video,2020-12-06,14838,501,0,Dec
588,The Expanse Exclusive Clip | Naomi Tells Holden She's Leaving,2020-12-05,34665,684,0,Dec
589,Fleabag Ending Explained | The Takeaway | Prime Video,2020-12-05,228856,7557,0,Dec
590,Best British Comedies | The Weekly Watchlist | Prime Video,2020-12-04,1480262,286,0,Dec
591,American Gods Season 3 – Official Trailer | Prime Video,2020-12-04,6760,115,0,Dec
592,Dating 101: Wayne | Prime Video,2020-12-03,30227,1199,0,Dec
