,Title,Published_date,Views,Likes,Favourite,Month
896,Heidi Klum and Tim Gunn in Making the Cut Paris | Prime Video,2020-04-05,7367,74,0,Apr
897,Tales From the Loop Soundtrack Music to Relax To | Prime Video,2020-04-04,1966100,3508,0,Apr
898,Selah and The Spades – Official Trailer | Prime Video,2020-04-03,1089042,3127,0,Apr
899,ItsHeyMorgan’s Self Care Watchlist | Amazon Prime Video April 2020,2020-04-02,5496,67,0,Apr
900,Making the Cut TV Show at Moulin Rouge | Prime Video,2020-03-31,11176,102,0,Mar
901,Jack Ryan Season 1 & 2 Best Scenes | Prime Video,2020-03-29,256811,1864,0,Mar
902,Fleabag’s Hot Priest Being Hot | Prime Video,2020-03-28,2263819,27768,0,Mar
903,Crowley in Good Omens Getting Sassy | Prime Video,2020-03-27,225246,9388,0,Mar
904,Hunters TV Cast Words to Live By | Prime Video,2020-03-26,6081,123,0,Mar
905,Troop Zero Trailer Great Quotes | Prime Video,2020-03-25,12112,161,0,Mar
906,Top Father Daughter Moments on The Marvelous Mrs. Maisel | Prime Video,2020-03-24,798534,4695,0,Mar
907,The Best Funny Moments with Fleabag and Claire | Prime Video,2020-03-23,227056,5058,0,Mar
908,The Boys Billy Butcher Gives Hughie the Best Advice Ever | Prime Video,2020-03-22,129987,2348,0,Mar
909,Chasing Happiness Documentary The Jonas Brothers Breakup,2020-03-21,427980,5302,0,Mar
910,Blow the Man Down Movie Fisherman's Song | Prime Video,2020-03-20,111067,1425,0,Mar
911,Selah and the Spades Exclusive Sneak Peek | Prime Video,2020-03-20,66520,4575,0,Mar
912,Hidden Secrets in Hunters series Subliminal Set Design | Prime Video,2020-03-19,750315,112,0,Mar
913,Simon Stålenhag Inspired Sci Fi in Tales from the Loop | Prime Video,2020-03-18,82385,1335,0,Mar
914,Bosch Season 6 – Official Trailer | Prime Video,2020-03-17,209304,1960,0,Mar
915,Upload - Official Trailer I Prime Video,2020-03-16,21490674,32427,0,Mar
916,The Expanse Series Most Heroic Moments | Prime Video,2020-03-15,83981,1252,0,Mar
917,Crowley and Aziraphale Being Human | Good Omens Episodes | Prime Video,2020-03-14,536227,2315,0,Mar
918,The Pale Horse Behind the Scenes Exclusive Insights | Prime Video,2020-03-13,25821,203,0,Mar
919,The Best Shia Labeouf Lines in Honey Boy | Prime Video,2020-03-11,19879,280,0,Mar
920,The Hunters Cast and Al Pacino Now Discuss the Series | Prime Video,2020-03-10,14280,210,0,Mar
921,Fleabag Show Sibling Rivalry Scenes | Prime Video,2020-03-10,286057,6048,0,Mar
922,Viola Davis Speaks Truth in Troop Zero Movie | Prime Video,2020-03-08,20234,186,0,Mar
923,The Expanse Series | Sci Fi Love Holden + Naomi | Prime Video,2020-03-07,109683,975,0,Mar
924,Good Omens | David Tennant and Michael Sheen | Prime Video,2020-03-06,162860,3218,0,Mar
925,The Boys Season 1 | Black Noir Best Of | Prime Video,2020-03-04,2390218,27689,0,Mar
926,16 Times Fleabag Lived Up To Her Name | Prime Video,2020-03-03,877695,8265,0,Mar
927,The Boys Are The Superheroes of Today | Prime Video,2020-03-02,90570,1626,0,Mar
928,The Most Marvelous of Mrs Maisel’s Stand Up | Prime Video,2020-03-01,749685,14331,0,Mar
929,Carnival Row Series | ASMR Relaxing Videos | Prime Video,2020-02-29,202389,900,0,Feb
930,The Expanse | Fashion Forward Avasarala | Prime Video,2020-02-28,33169,746,0,Feb
931,Fleabag Show | Awkward Flirting | Prime Video,2020-02-27,500296,7604,0,Feb
932,Tales From the Loop | Official Trailer,2020-02-27,3781435,19041,0,Feb
933,Alex Borstein in Mrs. Maisel: Best Moments | Prime Video,2020-02-26,76953,1436,0,Feb
934,The Boys Series Best Action Scenes | Prime Video,2020-02-25,43295,620,0,Feb
935,Making the Cut - Official Trailer I Prime Video,2020-02-24,2652837,1574,0,Feb
936,Logan Lerman From Hunters Behind The Scenes | Prime Video,2020-02-24,441214,861,0,Feb
937,Carnival Row Cast Vignette and Rycroft Square Off | Prime Video,2020-02-23,10845,137,0,Feb
938,The Marvelous Mrs. Maisel | Abe Weissman's Icon Moments | Prime Video,2020-02-22,779138,7946,0,Feb
939,Graffiti Art Time Lapse From Hunters | Prime Video,2020-02-20,421147,64,0,Feb
940,Carnival Row Episodes Vignette and Tourmaline BFF's | Prime Video,2020-02-18,14401,191,0,Feb
941,The Boys Series Super Hero Advice Scene Compilation | Prime Video,2020-02-17,11788,212,0,Feb
942,The Marvelous Mrs Maisel Midge and Susie BFF Goals | Prime Video,2020-02-16,192997,3857,0,Feb
943,Carnival Row Show With Fiercest Fairy Vignette Stonemoss | Prime Video,2020-02-15,16514,230,0,Feb
944,Modern Love Season 1 Kissing Scenes | Prime Video,2020-02-14,36040,191,0,Feb
945,NFL Players React to the Hunters Trailer I Prime Video,2020-02-13,14669,165,0,Feb
946,Hunters – Official Red Band Trailer I Prime Video,2020-02-13,178393,1691,0,Feb
947,Starlight + Hughie From The Boys Sweetest Moments | Prime Video,2020-02-12,566641,2272,0,Feb
948,This is a Love Story | Prime Video,2020-02-11,386467,267,0,Feb
949,Modern Love Series Cute Scenes | Prime Video,2020-02-10,35643,326,0,Feb
950,All or Nothing: The Philadelphia Eagles - Official Trailer | Prime Video,2020-02-07,43140,363,0,Feb
951,ZeroZeroZero - Official Trailer | Prime Video,2020-02-06,3357158,27278,0,Feb
952,The Vast Of Night – Official Trailer | Prime Video,2020-02-06,2696699,6433,0,Feb
953,Blow The Man Down – Official Trailer | Prime Video,2020-02-05,646544,1991,0,Feb
954,The Boys Series Starlight Speaks | Prime Video,2020-01-29,31841,606,0,Jan
955,Hunters Super Bowl Trailers | Prime Video,2020-01-28,10974841,857,0,Jan
956,Agatha Christie’s The Pale Horse - Official Trailer | Prime Video,2020-01-28,323251,3286,0,Jan
957,The Boys TV Show A-train vs Shockwave | Prime Video,2020-01-27,2099105,21662,0,Jan
958,90s TV and Creepy Shows Intro Reel | Prime Video,2020-01-25,12005,218,0,Jan
959,Troop Zero Talent Show Space Oddity Cover | Prime Video,2020-01-24,67240,798,0,Jan
960,The Boys Series Epic Fight Scene | Prime Video,2020-01-23,1576191,23409,0,Jan
961,Go Behind The Scenes with this Cast of Hunters Exclusive | Prime Video,2020-01-23,16357,268,0,Jan
962,The Most Iconic Florence Pugh Midsommar Moments | Prime VIdeo,2020-01-22,20033,306,0,Jan
963,Troop Zero | The Best Pieces of Southern Advice | Prime Video,2020-01-19,10430,146,0,Jan
964,Classic 90s Movies Streaming Now | Prime Video,2020-01-18,18690,168,0,Jan
965,The Birdies Sell Cookies | Troop Zero Movie Trailer | Prime Video,2020-01-17,40576,439,0,Jan
966,Iconic Moments From The All Time Greatest 80s Movies | Prime Video,2020-01-16,12492,129,0,Jan
967,Best Documentaries Streaming Now | Prime Video,2020-01-15,19215,134,0,Jan
968,Historical TV Shows & Period Drama Movies | Prime Video,2020-01-14,12479,142,0,Jan
969,All or Nothing: The Philadelphia Eagles - Teaser Trailer | Prime Video,2020-01-13,40958,310,0,Jan
970,The Expanse Season 4 | Bloopers and Outtakes | Prime Video,2020-01-12,279602,9200,0,Jan
971,Andrew Scott Scenes from Fleabag & Modern Love | Prime Video,2020-01-10,72262,1207,0,Jan
972,Top 10 Best Makeout Scenes | Prime Video,2020-01-09,1701723,5687,0,Jan
973,The Marvelous Mrs Maisel Moishe Maisel's Truth | Prime Video,2020-01-08,35218,540,0,Jan
974,Amazon Prime New Releases 2020 | Prime Video,2020-01-07,129367,994,0,Jan
975,The Marvelous Mrs Maisel Season 3 | Best Standup Scenes | Prime Video,2020-01-06,303952,4923,0,Jan
976,Best Amazon Prime Originals for Your Watch List | Prime Video,2020-01-06,21868,177,0,Jan
977,Maisel Shows Us 50’s Fitness | Prime Video,2020-01-04,646322,3339,0,Jan
978,Ilana Glazer Talks About Male Razors vs Female Razors | Prime Video,2020-01-03,45858,402,0,Jan
979,Ilana Glazer's Mind Jazz | The Planet Is Burning | Prime Video,2020-01-01,15331,155,0,Jan
980,Prime Video Sizzle Trailer | Prime Video,2019-12-31,100173,0,0,Dec
981,The Aeronauts Movie Felicity Jones Climbing Scene | Prime Video,2019-12-31,22663,223,0,Dec
982,Good Omens Aziraphale & Crowley Drinking Scene | Prime Video,2019-12-31,88805,2599,0,Dec
983,The Report with Adam Driver | Best Moments | Prime Video,2019-12-29,29995,559,0,Dec
984,Literally Just 2 minutes of The Best Adam Driver Movies | Prime Video,2019-12-25,205777,8596,0,Dec
985,Behind The Scenes of The Aeronauts | How It's Made | Prime Video,2019-12-23,22622,284,0,Dec
986,The Marvelous Mrs. Maisel Does Vegas | Prime Video,2019-12-21,638267,5946,0,Dec
987,The Aeronauts Actor Eddie Redmayne Interview | Prime Video,2019-12-20,7386,122,0,Dec
988,The Expanse Avasarala | Best One Liners | Prime Video,2019-12-19,163421,4383,0,Dec
989,Russell Peters: Deported - Official Trailer | Prime Video,2019-12-18,1099570,251,0,Dec
990,The Boys Series | Actors React to Bad Reviews | Prime Video,2019-12-18,4501739,166614,0,Dec
991,The Marvelous Chemistry of Midge & Lenny | Prime Video,2019-12-17,369096,6836,0,Dec
992,The Marvelous Maisel | Susie Myerson's First Flight | Prime Video,2019-12-17,58685,773,0,Dec
993,The Expanse TV Show | Best of Amos Burton | Prime Video,2019-12-16,615467,14718,0,Dec
994,John Smith Man in the High Castle | Best Moments | Prime Video,2019-12-16,67967,1077,0,Dec
995,Midge and Susie Being Marvelous at the Casino | Prime Video,2019-12-15,19159,252,0,Dec
996,The Expanse Cast Reveals Their True Selves | Prime Video,2019-12-15,562321,13148,0,Dec
997,The Maisel Marriage Ends in Divorce Court | Prime Video,2019-12-14,196119,2621,0,Dec
998,Marvelous Mrs. Maisel Season 3 in 3 Minutes | Prime Video,2019-12-13,52578,551,0,Dec
999,The Expanse Cast Explains Their Photos | Don’t @ Me,2019-12-13,241676,1898,0,Dec
1000,The Expanse Series Season 3 Ending | Prime Video,2019-12-13,49645,877,0,Dec
1001,Doja Cat Dresses Like Midge Maisel | Prime Video,2019-12-12,236720,5429,0,Dec
1002,Ted Bundy: Falling for a Killer Official Trailer | Prime Video,2019-12-12,287226,1918,0,Dec
1003,Rachel Brosnahan Explains Mrs Maisel Character | Prime Video,2019-12-11,183091,346,0,Dec
1004,Ilana Glazer Comedy Special “The Planet is Burning” Official Trailer | Prime Video,2019-12-11,114998,138,0,Dec
1005,Maisel Entertaining the Troops | Prime Video,2019-12-10,71846,1307,0,Dec
1006,Mrs. Maisel Surprised Fans with a Trip To Vegas | Prime Video,2019-12-10,8327,121,0,Dec
1007,The Expanse Season 4 - Space Opera Drone Show at Intersect 2019 | Prime Video,2019-12-09,20873,790,0,Dec
1008,The Boys Series | Homelander Scary Scenes | Prime Video,2019-12-09,665494,12749,0,Dec
1009,Watch Fleabag Awkward Sex Shop Scene | Prime Video,2019-12-08,16020,190,0,Dec
1010,Adam Driver The Report,2019-12-07,11297,198,0,Dec
1011,"The Marvelous Mrs. Maisel | ""Tits Up"" Compilation | Prime Video",2019-12-06,65215,472,0,Dec
1012,The Maisel Cast Gives You Marvelous Advice | Prime Video,2019-12-06,165209,184,0,Dec
1013,The Marvelous Mrs Maisel Season 3 Best Midge Scenes | Prime Video,2019-12-06,48069,545,0,Dec
1014,The Marvelous Mrs Maisel Last Embrace | Prime Video,2019-12-06,20278,243,0,Dec
1015,The Boys Season 2 Action Teaser | Prime Video,2019-12-05,678506,9433,0,Dec
1016,Troop Zero - Official Trailer | Prime Video,2019-12-05,4615664,4653,0,Dec
1017,Meet The Blue Origin Cast  | The Expanse | Prime Video,2019-12-05,58125,2012,0,Dec
1018,Imogen & Agreus Fantasy Romance Clips | Carnival Row | Prime Video,2019-12-04,29800,411,0,Dec
1019,The Cast Recaps Season 2 of The Marvelous Mrs. Maisel | Prime Video,2019-12-03,12563,170,0,Dec
1020,Jack Ryan Season 2 Bathroom Fight | Prime Video,2019-12-02,72919,626,0,Dec
1021,The Best of The Marvelous Mrs. Maisel's Stand Up | Prime Video,2019-12-01,723591,10363,0,Dec
1022,Jack Ryan TV Series BFF Moments with Jim Greer | Prime Video,2019-11-30,49430,529,0,Nov
1023,The Report: Meet The Characters | Prime Video,2019-11-29,6064,98,0,Nov
1024,Best Food Eating Scenes | Prime Video,2019-11-28,20427,243,0,Nov
1025,What to Watch: Holiday Movies | Prime Video,2019-11-28,6019,62,0,Nov
1026,Watch the Marvelous Mrs Maisel Abes Fitness Routine | Prime Video,2019-11-27,16872,207,0,Nov
1027,Holiday Movie Inspiration | Prime Video,2019-11-26,6528,85,0,Nov
1028,The Expanse Season 4 - Official Trailer: Pop Up Edition | Prime Video,2019-11-26,113615,4378,0,Nov
1029,Jack Ryan Season 2 | Blazing Hot Ambush Scene | Prime Video,2019-11-25,94956,646,0,Nov
1030,Brittany Runs A Marathon | 26.2 miles of Inspiration | Prime Video,2019-11-24,49803,570,0,Nov
1031,Jack Ryan Season 2 | Most Badass Moments | Prime Video,2019-11-23,259778,1827,0,Nov
1032,The Marvelous Mrs Maisel | Season 2 Recap | Prime Video,2019-11-22,150374,1697,0,Nov
1033,Hunters - Official Teaser Trailer I Prime Video,2019-11-21,7605167,8653,0,Nov
1034,The Expanse Season 4 - Official Trailer | Prime Video,2019-11-18,3562540,23249,0,Nov
1035,Diving Into The Expanse with Kevin Smith | Prime Video,2019-11-18,5073345,7331,0,Nov
1036,Crowley and Aziraphale From Good Omens | Prime Video,2019-11-17,58285,2235,0,Nov
1037,The Kacey Musgraves Christmas Show - Official Trailer | Prime Video,2019-11-14,2143657,1232,0,Nov
1038,A Thrilling Title Sequence for Jack Ryan Season 2 | Prime Video,2019-11-08,110800,1753,0,Nov
1039,The Kacey Musgraves Christmas Show Teaser | Prime Video,2019-11-04,44739,313,0,Nov
1040,Jack Ryan Season 2 Best Action Scenes | Prime Video,2019-11-02,195446,1496,0,Nov
1041,Heidi Klum's Halloween Makeover | Prime Video,2019-11-01,130046,2130,0,Nov
1042,Hunters - Tease: X Marks The Spot I Prime Video,2019-11-01,167432,739,0,Nov
1043,Tom Clancy's Jack Ryan Season 2 - Teaser Trailer | Prime Video,2019-11-01,219415,787,0,Nov
1044,ASMR Video | How to Carve a Pumpkin Resembling Jack Ryan | Prime Video,2019-10-31,6051,107,0,Oct
1045,Jack Ryan Season 1 Recap | Prime Video,2019-10-31,266756,2478,0,Oct
1046,Carrie Conspiracies | Prime Video,2019-10-30,6021,128,0,Oct
1047,Jack Ryan Season 1| Best Action Scenes | Prime Video,2019-10-29,251441,2172,0,Oct
1048,The Man in the High Castle Season 3 Official Recap | Prime Video,2019-10-29,184798,2475,0,Oct
1049,Modern Love Series Advice from the Doorman | Prime Video,2019-10-29,137290,2161,0,Oct
1050,Jack Ryan Season 1 | Long Story Short Episode 1 Recap | Prime Video,2019-10-26,48905,527,0,Oct
1051,Undone | Director Hisko Hulsing Explains How it's Made | Prime Video,2019-10-25,62991,2081,0,Oct
1052,Spooky Soundtrack For Horror Hounds | Prime Video,2019-10-24,4483,77,0,Oct
1053,The Aeronauts - Official Trailer 2 | Prime Video,2019-10-24,4324113,1933,0,Oct
1054,Billy Butcher - The Boys Character Trailer | Prime Video,2019-10-23,87318,2144,0,Oct
1055,Modern Love: Anne Hathaway’s Mindblowing Final Scene | Prime Video,2019-10-23,713176,12657,0,Oct
1056,Modern Love Series | Try Not to Cry Clips | Prime Video,2019-10-22,121201,1464,0,Oct
1057,Modern Love Opening Song & Vintage Slideshow | Prime Video,2019-10-21,166505,3603,0,Oct
1058,The Feed - Official Trailer | Prime Video,2019-10-21,153233,1201,0,Oct
1059,The Most Horrifying Horror Scenes| Prime Video,2019-10-20,7006,90,0,Oct
1060,Modern Love Review of Each Storyline | Prime Video,2019-10-18,1533377,7583,0,Oct
1061,The Man in the High Castle Season 4 - Official Trailer | Prime Video,2019-10-16,4409321,13267,0,Oct
1062,The Boys TV Show Bloody Superheroes | Prime Video,2019-10-15,10371,247,0,Oct
1063,The Report – Official Trailer 2 | Prime Video,2019-10-15,886352,3483,0,Oct
1064,The Marvelous Mrs. Maisel Season 3 - Official Trailer | Prime Video,2019-10-14,6744609,13888,0,Oct
1065,Movies That Will Turn You Into A Skeleton | Prime Video,2019-10-13,9802,130,0,Oct
1066,Orlando Bloom Carnival Row | Prime Video,2019-10-12,13151,189,0,Oct
1067,The Expanse New York Comic Con 2019 | Cast Panel | Prime Video,2019-10-09,492615,4245,0,Oct
1068,The Expanse Cast | Season 4 Teaser Reactions at NYCC | Prime Video,2019-10-07,16380,874,0,Oct
1069,Phoebe Waller Bridge Fleabag | Hair is Everything | Prime Video,2019-10-06,647925,15038,0,Oct
1070,The Expanse Season 4 Official Teaser | Prime Video,2019-10-05,529254,11685,0,Oct
1071,Recapping The Thirst From Fleabag Episode 1 | Prime Video,2019-10-04,35467,275,0,Oct
1072,Quality Time with Jim Gaffigan: Best Tour Jokes | Prime Video,2019-10-01,530644,6059,0,Oct
1073,Carnival Row Recap: Episode 1 | Prime Video,2019-09-28,25478,275,0,Sep
1074,"""Undone Mind Blowing Sneak Peeks | Prime Video""",2019-09-25,20352,459,0,Sep
1075,Transparent Show Making a Musical | Prime Video,2019-09-24,5542,61,0,Sep
1076,Fleabag Getting Her Emmys Bag | Prime Video,2019-09-23,1199514,21878,0,Sep
1077,Alex Bornstein in Mrs. Maisel Takes No Guff | Prime Video,2019-09-22,55440,1233,0,Sep
1078,Phoebe From Fleabag's Steamiest Scenes | Prime Video,2019-09-22,278888,1518,0,Sep
1079,The Marvelous Mrs Maisel | Long Story Short Recaps Pilot | Prime Video,2019-09-21,88584,1178,0,Sep
1080,Fleabag TV Show | The Hot Priest Serves 2 Min of Heat | Prime Video,2019-09-21,867867,12744,0,Sep
1081,Savage x Fenty All Star World Premiere | Prime Video,2019-09-21,65369,840,0,Sep
1082,Olivia Colman as Godmother in Fleabag Show | Best Burns | Prime Video,2019-09-20,297084,3871,0,Sep
1083,Savage x Fenty Show - Performance Preview | Prime Video,2019-09-19,967773,4712,0,Sep
1084,Savage x Fenty Show - Teaser Trailer | Prime Video,2019-09-17,1827047,4308,0,Sep
1085,Modern Love - Official Trailer | Prime Video,2019-09-12,5759987,25167,0,Sep
1086,Inside the Steampunk Costume Design of Carnival Row | Prime Video,2019-09-10,15235,275,0,Sep
1087,Behind The Scenes With The Cast of Carnival Row | Prime Video,2019-09-07,21897,489,0,Sep
1088,Undone Live Action Animation | Prime Video,2019-09-06,76210,1631,0,Sep
1089,Tom Clancy's Jack Ryan Season 2 - Official Trailer | Prime Video,2019-09-05,16938904,16196,0,Sep
1090,Carnival Row - Teaser: What Critics Are Saying | Prime Video,2019-08-30,1457239,381,0,Aug
1091,Meek Mill Talks Free Meek I Prime Video,2019-08-29,5299,38,0,Aug
1092,The Aeronauts - Official Trailer,2019-08-29,10082190,37178,0,Aug
1093,Carnival Row - Teaser: Refugees of Carnival Row | Prime Video,2019-08-26,31385,471,0,Aug
1094,The Boys Episode 1 Scene Breakdown | Prime Video,2019-08-24,24032,454,0,Aug
1095,Goliath Season 3 - Official Trailer | Prime Video,2019-08-22,4018554,1149,0,Aug
1096,The Report - Teaser Trailer,2019-08-22,6728126,7159,0,Aug
1097,Literally Just Every Time Fleabag Looked At Us | Prime Video,2019-08-20,37164,874,0,Aug
1098,The Marvelous Mrs. Maisel Season 3 Official Teaser | Prime Video,2019-08-19,862778,14221,0,Aug
1099,The Expanse Cast vs Nasa Scientist Space Trivia | Prime Video,2019-08-13,34371,1208,0,Aug
1100,Carnival Row Season 1 - Official Trailer | Prime Video,2019-08-06,8299338,49156,0,Aug
1101,The Expanse Season 4 Superfans Behind the Scenes | Prime Video,2019-08-06,49906,2035,0,Aug
1102,Follow Orlando Bloom and Carnival Row cast at SDCC 2019 | Prime Video,2019-08-02,20567,339,0,Aug
1103,The Expanse SDCC Panels Wes Chatham Meets Buzz Aldrin | Prime Video,2019-07-31,12205,311,0,Jul
1104,Carnival Row Cast Pull Off SDCC 2019 Cosplay Surprise | Prime Video,2019-07-31,17952,268,0,Jul
1105,The Expanse Comic Con 2019 Discuss the Zero G Beer Scene | Prime Video,2019-07-30,12576,379,0,Jul
1106,Exclusive Story Session With The Expanse Cast SDCC 2019 | Prime Video,2019-07-29,29375,1109,0,Jul
1107,Undone - Official Trailer | Prime Video,2019-07-27,1413704,18298,0,Jul
1108,Modern Love - Teaser Trailer | Prime Video,2019-07-27,218295,907,0,Jul
1109,Transparent: Musicale Finale - Official Trailer | Prime Video,2019-07-27,1934339,279,0,Jul
1110,The Expanse Season 4 Trailer | Prime Video,2019-07-27,131766,4315,0,Jul
1111,Jack Ryan Season 2 Official Teaser | Prime Video,2019-07-27,847625,14138,0,Jul
1112,The Boys - Exclusive: Portal A Hero | Prime Video,2019-07-26,2689977,1054,0,Jul
1113,Cast of The Expanse Discussion on Diversity at SDCC 2019 | Prime Video,2019-07-26,14116,350,0,Jul
1114,Dominique Tipper of The Expanse Show at SDCC 2019 Panel | Prime Video,2019-07-23,16616,418,0,Jul
1115,The Boys - Final Trailer | Prime Video,2019-07-23,6034056,73351,0,Jul
1116,The Man in The High Castle SDCC 2019 | Prime Video,2019-07-23,26315,433,0,Jul
1117,The Boys Superheros SDCC 2019 Red Carpet Event | Prime Video,2019-07-22,14483,254,0,Jul
1118,San Diego Comic Con Panel Explaining Carnival Row | Prime Video,2019-07-21,17590,251,0,Jul
1119,The Expanse Cast 2019 SDCC Cosplayer Surprise | Prime Video,2019-07-21,22195,819,0,Jul
1120,The Man in the High Castle S4 | Prime Video,2019-07-21,413181,7690,0,Jul
1121,The Expanse Show Season 4 Premiere | Prime Video,2019-07-20,574586,11033,0,Jul
1122,Carnival Row Series | Philo's Story | Prime Video,2019-07-20,2925594,5815,0,Jul
1123,Carnival Row Vignette Reveals That She is From the Fae | Prime Video,2019-07-20,1070787,2660,0,Jul
1124,This is Football - Official Trailer | Prime Video,2019-07-02,438874,16715,0,Jul
1125,The Boys Series Cast and Crew Reveal The Show's Moral | Prime Video,2019-06-30,2180335,3521,0,Jun
1126,Terry Pratchett From Good Omens Tribute | Prime Video,2019-06-28,66753,3676,0,Jun
1127,All or Nothing: The Carolina Panthers - Official Trailer | Prime Video,2019-06-26,81425,747,0,Jun
1128,Carnival Row - Official Teaser: Welcome to Carnival Row | Prime Video,2019-06-24,61883,554,0,Jun
1129,Free Meek - Official Trailer | Prime Video,2019-06-24,1699221,1910,0,Jun
1130,Undone - Teaser Trailer | Prime Video,2019-06-07,237745,2631,0,Jun
1131,Carnival Row - Official Teaser: Philo and Vignette | Prime Video,2019-06-03,467779,1766,0,Jun
1132,Jonas Brothers Younger Brother Nick Jonas on Happiness | Prime Video,2019-05-31,45568,1146,0,May
1133,The Expanse Cast & Good Customer Service | Prime Video,2019-05-25,141591,5232,0,May
1134,Fleabag Season 2 Andrew Scott Actor & Hot Priest Scenes | Prime Video,2019-05-20,33417,578,0,May
1135,Jonas Brothers’ Chasing Happiness - Official Trailer | Prime Video,2019-05-09,2244857,8454,0,May
1136,Watch The Jonas Brothers Documentary Chasing Happiness | Prime Video,2019-05-08,60907,1143,0,May
1137,The Boys Series Starlight's Skincare | Prime Video,2019-05-01,1035234,24830,0,May
1138,The Boys Chace Crawford Kirei Shoyu Ad | Prime Video,2019-04-29,891827,23039,0,Apr
1139,Good Omens Show Singing Nuns | Brand New Baby Smell | Prime Video,2019-04-25,1054673,18608,0,Apr
1140,Fleabag Season 1 Ninja Surprise Scene | Prime Video,2019-04-24,140126,1468,0,Apr
1141,Mrs. Maisel Paris Stand Up | The Marvelous Mrs. Maisel | Prime Video,2019-04-22,162505,2293,0,Apr
1142,Tom Clancy's Jack Ryan | Garden Party Clip | Prime Video,2019-04-21,2057256,12487,0,Apr
1143,Guava Island | Summertime Magic  | Prime Video,2019-04-18,5793328,124856,0,Apr
1144,Good Omens Behind The Scenes Sneak Preview | Prime Video,2019-04-17,196995,9030,0,Apr
1145,The Boys - Uncensored Teaser Trailer: “Spank” | Prime Video,2019-04-17,594936,4355,0,Apr
1146,Good Omens Show Crowley's Lullaby | Prime Video,2019-04-15,157316,2205,0,Apr
1147,Guava Island Movie Deni's Guitar | Prime Video,2019-04-15,503940,2124,0,Apr
1148,Guava Island Trailer Deni & Kofi Flirting | Prime Video,2019-04-13,1132579,12181,0,Apr
1149,Fleabag Season 2 - Official Trailer | Prime Video,2019-04-11,978096,4946,0,Apr
1150,Crime Series Sneaky Pete Season 3 Trailer | Prime Video,2019-04-08,68411,1051,0,Apr
1151,Hanna Season 1 Female Fight Scenes | Prime Video,2019-04-01,5766322,981,0,Apr
1152,The Man in the High Castle Season 3 - Exclusive: Fight for the World You Want | Prime Video,2019-03-22,63563,1209,0,Mar
1153,Hanna Season 1 & the Making of Fight Scenes | Prime Video,2019-03-20,2303557,788,0,Mar
1154,Hanna Soundtrack Season 1 | Prime Video,2019-03-08,1192087,1134,0,Mar
1155,Bosch - Season 5 Official Trailer | Prime Video,2019-02-28,214608,1146,0,Feb
1156,The Tick Season 2 - Official Trailer | Prime Video,2019-02-27,1642822,5987,0,Feb
1157,The Expanse Series Cas Anvar Seasons 1&2 Recap | Prime Video,2019-02-22,101132,1109,0,Feb
1158,The Man in the High Castle Season 4 Final Season Teaser | Prime Video,2019-02-19,1287350,13304,0,Feb
1159,Watch Good Omens Casting Benedict Cumberbatch | Prime Video,2019-02-14,43585,521,0,Feb
1160,Good Omens Opening Title Sequence | Prime Video,2019-02-13,647393,14189,0,Feb
1161,Catastrophe Season 4 - Official Trailer | Prime Video,2019-02-12,2503598,212,0,Feb
1162,The Expanse Cast Comments On No Season 4 | Prime Video,2019-02-10,52585,1978,0,Feb
1163,The Expanse Cast & What's The Expanse About | Prime Video,2019-02-09,18323,516,0,Feb
1164,The Expanse - Exclusive: New Home | Prime Video,2019-02-02,99535,2788,0,Feb
1165,What’s New on Prime Video - Exclusive | Prime Video,2019-02-02,13230,177,0,Feb
1166,Hanna Season 1 Be the Girl No One Saw Coming | Prime Video,2019-01-30,20461785,3879,0,Jan
1167,The Boys Superhero Montage Official Teaser (HD) | Prime Video,2019-01-24,339385,2330,0,Jan
1168,The Expanse - Exclusive: Watch All Seasons Now | Prime Video,2019-01-23,27126,600,0,Jan
1169,This Giant Beast That is the Global Economy - Official Trailer | Prime Video,2019-01-14,138315,1744,0,Jan
1170,The Widow - Official Trailer | Prime Video,2019-01-14,5589285,2344,0,Jan
1171,White Dragon - Official Trailer | Prime Video,2019-01-09,49067,222,0,Jan
1172,Lorena - Official Trailer | Prime Video,2019-01-08,6334119,1282,0,Jan
1173,The ABC Murders - Official Trailer [HD] | Prime Video,2018-12-27,390696,2407,0,Dec
1174,Informer Season 1 - Official Trailer | Prime Video,2018-12-20,96477,452,0,Dec
1175,Rosebud Comedian on Inside Jokes Season 1 | Prime Video,2018-12-10,41217,443,0,Dec
1176,The Grand Tour Season 3 - Official Trailer | Prime Video,2018-11-27,6547410,10192,0,Nov
1177,Marvelous Mrs Maisel Episodes Season 1 Recap | Prime Video,2018-11-14,143628,1140,0,Nov
1178,Extreme Driving | Cliff Drifting in Gymkhana Cars | Prime Video,2018-11-12,178258,439,0,Nov
1179,The Man in the High Castle Season 3 Actor John Smith | Prime Video,2018-11-02,25259,337,0,Nov
1180,The Marvelous Mrs. Maisel Season 2 - Official Trailer [HD] | Prime Video,2018-10-24,2366410,8500,0,Oct
1181,Halloween: A Love Story - Exclusive | Prime Video,2018-10-19,82192,4327,0,Oct
1182,The Gymkhana Files - Official Teaser Trailer | Prime Video,2018-10-10,95761,486,0,Oct
1183,Patriot Season 2 - Official Trailer | Prime Video,2018-10-09,79544,672,0,Oct
1184,The Boys Series NYCC 2018 Panel Simon Pegg Reveal | Prime Video,2018-10-06,22123,328,0,Oct
