,Title,Published_date,Views,Likes,Favourite,Month
593,Community Series Craziest Teachers | Prime Video,2020-12-02,5543,135,0,Dec
594,VIKINGS Final Season – Official Trailer | Amazon Prime Video,2020-12-02,5395147,113207,0,Dec
595,Now Streaming on Prime Video US December 2020 | Prime Video,2020-12-01,1630192,214,0,Dec
596,Janelle Monae Lego Art Time Lapse | Prime Video,2020-12-01,4612,84,0,Dec
597,Meet the Teams from The Pack | Prime Video,2020-11-30,12707,167,0,Nov
598,"Sylvie’s Love | Right Love, Wrong Time | Prime Video",2020-11-30,277212,160,0,Nov
599,Small Axe | Alex Wheatle Trailer | Prime Video,2020-11-30,14297,184,0,Nov
600,Kristen Stewart in Twilight: Sighing 101| Prime Video,2020-11-29,30098,249,0,Nov
601,Best of Miller The Expanse | Prime Video,2020-11-28,38570,854,0,Nov
602,Borat 2 Obvious Plant Action Figure Demo | Prime Video,2020-11-27,12725,379,0,Nov
603,The Expanse | Protomole-Yule Log,2020-11-26,44589,972,0,Nov
604,Thanksgiving Movie Deep Cut Trivia | Prime Video,2020-11-25,4121,39,0,Nov
605,In Conversation: TIME filmmaker Garrett Bradley and Ava DuVernay,2020-11-25,5541,157,0,Nov
606,Borat Subsequent Moviefilm: Unpacking the History of Borat ft Wisecrack,2020-11-24,71832,1775,0,Nov
607,Frank Tells Beth He Is Gay | Uncle Frank,2020-11-24,22749,347,0,Nov
608,"Small Axe | Red, White and Blue Trailer | Prime Video",2020-11-24,33484,460,0,Nov
609,Techie Moments From Upload: TikTok Compilation | Prime Video,2020-11-23,4249,70,0,Nov
610,We STAN Troy and Abed in Community | Prime Video,2020-11-22,390093,204,0,Nov
611,Truth Seekers | Nick Frost Stan Cam | Prime Video,2020-11-21,6840,145,0,Nov
612,Wayne Famous Freakouts Compilation | Prime Video,2020-11-20,83813,2155,0,Nov
613,Moonlight | Most Intimate Moments | Prime Video,2020-11-19,256746,2634,0,Nov
614,One Night in Miami... | Official Trailer,2020-11-18,10230472,7182,0,Nov
615,The Wilds - Official Trailer | Prime Video,2020-11-18,5198092,9847,0,Nov
616,Hanna and Clara’s Unbreakable BFF Bond | Prime Video,2020-11-17,12756,231,0,Nov
617,Making the Cut: Several Sassy Sayings of Sander | Prime Video,2020-11-16,7282,143,0,Nov
618,Small Axe | Lovers Rock Trailer | Prime Video,2020-11-16,139630,686,0,Nov
619,Troy From Community Stan Cam | Prime Video,2020-11-15,1396963,208,0,Nov
620,The Boys Flipbook Tutorial | Prime Video,2020-11-14,319360,388,0,Nov
621,Funny Moments of Jayde Adams on TikTok | Prime Video,2020-11-13,34665,919,0,Nov
622,Friendship Goals: Forever | Prime Video,2020-11-12,6113,84,0,Nov
623,Headphones On: Soothing Sounds From Upload | Prime Video,2020-11-11,3043907,292,0,Nov
624,Best Quotes From Mindy Kaling in Late Night | Prime Video,2020-11-10,10449,136,0,Nov
625,Small Axe Anthology Trailer - Extended Version | Prime Video,2020-11-09,97014,1025,0,Nov
626,The Pack - Official Trailer | Prime Video,2020-11-09,2467851,1364,0,Nov
627,El Presidente Season 1 – Official Trailer | Prime Video,2020-11-07,1080188,387,0,Nov
628,Palm Springs | Prime Video,2020-11-04,899,45,0,Nov
629,Truth Seekers Creepy Compilation | Prime Video,2020-11-02,6619,112,0,Nov
630,Inspiring Compilation from All In: The Fight For Democracy | Prime Video,2020-11-01,8232,140,0,Nov
631,Now Streaming on Prime Video US in November 2020 | Prime Video,2020-11-01,1445945,338,0,Nov
632,Borat Dance Party With Fans,2020-11-01,1216763,5840,0,Nov
633,Best Borat Quotes of 2020 | Prime Video,2020-10-31,130949,1793,0,Oct
634,We Love Butcher's Foul Mouth in The Boys | Prime Video,2020-10-30,317109,8698,0,Oct
635,Perks of The Afterlife in Forever | Prime Video,2020-10-29,8925,170,0,Oct
636,Gina Brillon Comedy TikTok Compilation | Prime Video,2020-10-28,30453,943,0,Oct
637,The Boys - Season 2 Bloopers | Prime Video,2020-10-27,2328141,62853,0,Oct
638,Borat 2 Best Disguises Compilation | Prime Video,2020-10-26,68685,1094,0,Oct
639,Wayne – Official Trailer | Prime Video,2020-10-26,719077,14027,0,Oct
640,Best Of Queen Maeve From The Boys | Prime Video,2020-10-25,118381,2638,0,Oct
641,Borat Subsequent Moviefilm: Q&A with Borat (Internet Presentation) | Prime Video,2020-10-24,959216,23568,0,Oct
642,3 Character Cosplays You Can Try At Home | Prime Video,2020-10-22,1292732,315,0,Oct
643,Top 10 Sci Fi Scenes from Electric Dreams | Prime Video,2020-10-21,12501,180,0,Oct
644,Schitt’s Creek Ultimate Moira Stan Compilation | Prime Video,2020-10-20,337326,4341,0,Oct
645,Luke From Upload | Best Moments Compilation | Prime Video,2020-10-19,9546,210,0,Oct
646,Funniest Pranks From Borat | Prime Video,2020-10-18,3266006,45254,0,Oct
647,Welcome To The Blumhouse LIVE: Ludacris & JADALAREIGN,2020-10-18,6222,183,0,Oct
648,Best Roles of Reese Witherspoon | Greatest Hits | Prime Video,2020-10-17,9361,150,0,Oct
649,Welcome To The Blumhouse LIVE: Questlove,2020-10-17,11474,228,0,Oct
650,Hilarious TikTok Compilation The Marvelous Mrs. Maisel | Prime Video,2020-10-16,29054,278,0,Oct
651,Star Trek: The Next Generation Best Episodes to Rewatch | Prime Video,2020-10-15,29585,188,0,Oct
652,Uncle Frank – Official Trailer | Prime Video,2020-10-15,5899260,8829,0,Oct
653,What to Watch After You've Finished The Boys Season 2 | Prime Video,2020-10-14,14656,492,0,Oct
654,Sylvie's Love - Official Trailer | Prime Video,2020-10-14,1771391,4933,0,Oct
655,Fleabag Hot Priest Lego Time Lapse | Prime Video,2020-10-13,4973,125,0,Oct
656,I'm Your Woman - Official Trailer,2020-10-13,1326156,6072,0,Oct
657,Zainab Johnson is Hilarious in Upload Season 1 | Prime Video,2020-10-12,13546,261,0,Oct
658,Heist Movies to Watch With Friends | Prime Video,2020-10-11,347115,290,0,Oct
659,The Boys Season 2 Starlight and Hughie Cute Scenes Together | Prime Video,2020-10-10,618405,4663,0,Oct
660,American Gods Season 3 | Prime Video,2020-10-10,1366,61,0,Oct
661,The Funniest TikToks from Russell Peters: Deported | Prime Video,2020-10-09,675757,362,0,Oct
662,Chasing the Crown: Dreamers to Streamers – Official Trailer | Prime Video,2020-10-09,5409,65,0,Oct
663,The Expanse – Season 5 Official Trailer,2020-10-08,2413746,56914,0,Oct
664,Invincible – Teaser Trailer | Prime Video,2020-10-08,1416862,50580,0,Oct
665,Utopia Exclusive Deleted Scene,2020-10-08,16555,250,0,Oct
666,The Farewell Unexpected Funny Moments | Prime Video,2020-10-07,49489,239,0,Oct
667,Utopia Best Moments of Jessica Hyde | Prime Video,2020-10-06,15234,177,0,Oct
668,THE PACK | Teaser,2020-10-06,58562,428,0,Oct
669,16 Spongebob Songs for Nostalgia | Prime Video,2020-10-05,1880954,941,0,Oct
670,What The Constitution Means To Me – Official Trailer | Prime Video,2020-10-05,68527,556,0,Oct
671,Funniest Comedy Movie Quotes | Prime Video,2020-10-04,32766,431,0,Oct
672,Scary Movies 101 | Prime Video,2020-10-03,10964,221,0,Oct
673,Now Streaming in October 2020 | Prime Video,2020-10-02,2041853,486,0,Oct
674,Welcome to the Blumhouse – What’s Up by FJØRA,2020-10-02,11487,288,0,Oct
675,Savage X Fenty Show Vol. 2 – Official Trailer I Prime Video,2020-10-01,904834,11106,0,Oct
676,Borat Subsequent Moviefilm - Official Trailer | Prime Video,2020-10-01,9198684,67662,0,Oct
677,Borat Is Back | Prime Video,2020-10-01,702828,10959,0,Oct
678,Good Girls Revolt Moments That Will Leave You Inspired | Prime Video,2020-09-30,7394,92,0,Sep
679,Will Smith As Muhammad Ali | Prime Video,2020-09-29,654604,13261,0,Sep
680,Relationship Goals From Prime Video's New Show Utopia,2020-09-28,15826,188,0,Sep
681,Best Spy Movies On Prime Video 2020 | Prime Video,2020-09-27,36013,412,0,Sep
682,15 Funniest TikTok Videos Of Fleabag From Prime Video,2020-09-26,11255,306,0,Sep
683,Savage X Fenty Show Vol. 2 – Official BTS Tease I Prime Video,2020-09-25,128066,1277,0,Sep
684,World’s Toughest Race: Eco-Challenge Fiji – Official Trailer,2020-09-25,52897,409,0,Sep
685,Best of Awkwafina in The Farewell as Billi Wang | Prime Video,2020-09-24,118103,651,0,Sep
686,Sound of Metal – Official Trailer | Prime Video,2020-09-24,3442455,33136,0,Sep
687,Truth Seekers – Official Trailer | Prime Video,2020-09-23,5187689,4052,0,Sep
688,Emotional Moments in World's Toughest Race | Prime Video,2020-09-22,5054,48,0,Sep
689,Timothee Chalamet & Armie Hammer Having Sexual Tension for 5 Minutes Straight,2020-09-21,659535,13314,0,Sep
690,ASMR in Jack Ryan Season 1 & 2 | Satisfying Sounds of Prime Video,2020-09-20,13274,160,0,Sep
691,Small Axe Anthology Trailer | Prime Video,2020-09-20,2755457,897,0,Sep
692,The Marvelous Mrs. Maisel Best Food Moments | Prime Video,2020-09-19,58098,803,0,Sep
693,Utopia Clip: Mythology | Prime Video,2020-09-18,8397,99,0,Sep
694,The BEST TikTok Compilation of The Boys Season 1,2020-09-18,35788,781,0,Sep
695,Savage X Fenty Show Vol. 2 – Announcement I Prime Video,2020-09-17,30136,377,0,Sep
696,Utopia Official REDBAND Trailer | Prime Video,2020-09-17,62257,734,0,Sep
697,Nocturne – Official Trailer,2020-09-16,714676,5674,0,Sep
698,The Lie – Official Trailer,2020-09-16,1372463,13336,0,Sep
699,Black Box – Official Trailer,2020-09-16,1120279,5185,0,Sep
700,Evil Eye – Official Trailer,2020-09-16,725902,4224,0,Sep
701,Top 8 Intense Moments in World's Toughest Race | Prime Video,2020-09-15,9473,80,0,Sep
702,A Quiet Place - ASMR Apocalypse | Amazon Prime Video,2020-09-14,13517,358,0,Sep
703,Suspense Movies on Prime Video That You NEED to Watch,2020-09-13,35438,356,0,Sep
704,Lili Reinhart and Austin Abrams are Relationship Goals in Chemical Hearts,2020-09-12,28592,392,0,Sep
705,Korean Movies to Watch on Amazon Prime Video (2020),2020-09-11,361868,3941,0,Sep
706,The Golden Girls – Now Streaming on Prime Video,2020-09-11,393,7,0,Sep
707,Best Fight Scenes from Hanna Season 2,2020-09-10,80645,875,0,Sep
708,Jimmy O. Yang Talks About His Weirdest Dreams | Prime Video,2020-09-09,5864,89,0,Sep
709,Sound of Metal - Coming Soon to Theaters and Prime Video,2020-09-09,15212,283,0,Sep
710,One Night in Miami... | First Look Clip,2020-09-08,106129,1348,0,Sep
711,The Relationship Arc Of Rodrigo & Hailey in Mozart In The Jungle,2020-09-08,28138,397,0,Sep
712,Kristen Schaal in My Spy is Hilarious! | Funny Moments,2020-09-07,15296,266,0,Sep
713,Rami Malek Ranting for 10 Straight Minutes in Mr. Robot | Prime Video,2020-09-06,1668003,2855,0,Sep
714,Poetic Moments from Chemical Hearts That Will Make Your Heart Melt,2020-09-05,36940,1719,0,Sep
715,Best Of Beyonce as Etta James in Cadillac Records | Prime Video,2020-09-04,40078,649,0,Sep
716,The Boys Cast & Crew Deep Dive into Season 1 | Prime Rewind: Inside The Boys,2020-09-03,1960957,1879,0,Sep
717,Best Classical Music Moments From Mozart in the Jungle,2020-09-02,37022,581,0,Sep
718,Welcome to the Blumhouse – Official Trailer,2020-09-02,3494168,4067,0,Sep
719,What to Watch on Amazon Prime Video September 2020,2020-09-01,92800,654,0,Sep
720,ASMR TV Shows | A Day in the Laboratory - Binaural Sounds in Radioactive,2020-08-31,8557,189,0,Aug
721,The Boys Season 2 – Vought Shopping Network | Prime Video,2020-08-31,34656,921,0,Aug
722,The Funniest Scenes of DJ Beatroot from Get Duked!,2020-08-30,18945,420,0,Aug
723,Get Duked! BTS of the Run The Jewels “Out of Sight” Music Video | Prime Video,2020-08-30,7156,113,0,Aug
724,Gina Brillon Stand-up Special - The Floor is Lava | Amazon Prime Video,2020-08-29,116756,3958,0,Aug
725,Best of Hong Chau in Homecoming Season 2 | Prime Video,2020-08-27,7481,102,0,Aug
726,ASMR TV Shows | Binaural Wilderness Sounds from Hanna Season 1 and Season 2,2020-08-26,11348,169,0,Aug
727,Best Moments of Gael Garcia Bernal in Mozart in the Jungle,2020-08-25,34845,524,0,Aug
728,A Marvelous Night at the Apollo | Amazon Prime Video,2020-08-24,699200,768,0,Aug
729,Best Action Scenes from My Spy | Amazon Prime Video,2020-08-23,4848,112,0,Aug
730,Best of Lili Reinhart in Chemical Hearts | Amazon Prime Video,2020-08-22,51409,958,0,Aug
731,Chemical Hearts – I’m Not Gonna Stalk Her Clip,2020-08-22,16709,287,0,Aug
732,TIME – Official Trailer | Prime Video,2020-08-21,255629,2426,0,Aug
733,Chemical Hearts – Official Trailer | Watch Now on Prime Video,2020-08-21,16268,395,0,Aug
734,Eddie Redmayne and Felicity Jones are Relationship Goals in Aeronauts,2020-08-20,12467,162,0,Aug
735,Top 5 Bruce Lee Moments from Fist of Fury,2020-08-19,284812,1443,0,Aug
736,Chemical Hearts – Magical Enchanted Forest Clip,2020-08-18,9720,150,0,Aug
737,Utopia – Official Trailer,2020-08-18,4221144,6870,0,Aug
738,ALL IN: The Fight For Democracy – Official Trailer | Prime Video,2020-08-17,2502962,1946,0,Aug
739,James Greer is a Boss in Jack Ryan | Prime Video,2020-08-16,44298,411,0,Aug
740,Building a Miniature of Fleabag's Guinea Pig Cafe | Prime Video,2020-08-15,217167,295,0,Aug
741,Best TikTok Comedy Compilation: Jimmy O. Yang on Prime Video,2020-08-14,2699794,110442,0,Aug
742,ASMR from Homecoming Season 2 | Amazon Prime Video,2020-08-13,2790,82,0,Aug
743,How to Be a Teenager According to Hanna | Amazon Prime Video,2020-08-12,8430,140,0,Aug
744,The Eternal Wisdom of James Baldwin,2020-08-11,126496,511,0,Aug
745,OUTSTANDING ORIGINAL MUSIC AND LYRICS - “One Less Angel”,2020-08-10,39421,773,0,Aug
746,Heidi Klum and Tim Gunn are BFF Goals on Making the Cut,2020-08-10,6879,92,0,Aug
747,The Best of Joseph Gordon-Levitt in 7500,2020-08-09,21043,246,0,Aug
748,What to Watch on Amazon Prime Video August 2020,2020-08-07,902480,434,0,Aug
749,Small Axe First Look Trailer,2020-08-07,52335,691,0,Aug
750,The Boys Season 2 | The Deep's Reckoning | Prime Video,2020-08-06,1084355,21047,0,Aug
751,Rafting | World's Toughest Race,2020-08-06,7966,73,0,Aug
752,Sailing | World's Toughest Race,2020-08-04,12663,77,0,Aug
753,The Boys Season 2 - Official Trailer | Amazon Prime Video,2020-08-04,7398368,125585,0,Aug
754,The Fleabag Cosplay Makeup Tutorial ft. Alyson Tabbitha | Prime Video,2020-08-03,25830,277,0,Aug
755,Get Duked! – Official Redband Trailer | Prime Video,2020-08-03,219344,1898,0,Aug
756,ASMR from Homecoming Season 1 | Amazon Prime Video,2020-08-02,281730,119,0,Aug
757,Jungle Trekking | World's Toughest Race,2020-08-02,17639,154,0,Aug
758,Hanna TV Series Season 2  Badass Action Scenes | Prime Video,2020-07-31,38524,532,0,Jul
759,World's Toughest Race Bili Bili Episode | Prime Video,2020-07-31,13983,131,0,Jul
760,Forever Series ASMR Scenes | Prime Video,2020-07-30,5720,85,0,Jul
761,Honey Boy Trailer Shia Labeouf Life Story | Prime Video,2020-07-29,103651,1623,0,Jul
762,Chemical Hearts – Official Trailer | Prime Video,2020-07-29,11467035,46585,0,Jul
763,World's Toughest Race Extreme Biking Scenes | Prime Video,2020-07-29,27435,187,0,Jul
764,Marie Curie Radioactive | Prime Video,2020-07-28,44544,907,0,Jul
765,Nicole Richie Being the Most Supportive Judge on Making the Cut,2020-07-27,8542,86,0,Jul
766,World's Toughest Race Swimming Challenge | Prime Video,2020-07-27,26826,190,0,Jul
767,ASMR with Jack Ryan Season 1 and Season 2 | Satisfying Sounds,2020-07-26,10722,244,0,Jul
768,5 Best Movies On Demand | Prime Video,2020-07-25,33464,342,0,Jul
769,World's Toughest Race Climbing Challenge | Prime Video,2020-07-25,48402,184,0,Jul
770,Upload Cast SDCC 2020 Zoom Panel | Prime Video,2020-07-24,7766,202,0,Jul
771,Utopia Cast SDCC 2020 Zoom Panel | Prime Video,2020-07-24,6369,61,0,Jul
772,The Truth Seekers UK SDCC 2020 Virtual Panel | Prime Video,2020-07-24,5954,85,0,Jul
773,The Boys Season 2 SDCC 2020 Superhero Panel | Prime Video,2020-07-24,3626450,11416,0,Jul
774,The Boys Season 2 Trailer Superhero Whale Scene | Prime Video,2020-07-23,1696816,38735,0,Jul
775,Utopia - Official Teaser,2020-07-23,251113,1999,0,Jul
776,Truth Seekers – Official Teaser,2020-07-23,351321,6436,0,Jul
777,Janelle Monae is Relationship Goals in Homecoming Season 2,2020-07-21,21774,313,0,Jul
778,The Last Narc – Official Trailer | Prime Video,2020-07-21,197578,1858,0,Jul
779,Best Dave Bautista My Spy Scenes | Prime Video,2020-07-20,20803,279,0,Jul
780,Tom Clancy's Jack Ryan Action Show Chase Scenes | Prime Video,2020-07-19,13254,208,0,Jul
781,Shows With Strong Lady Leads | Prime Video,2020-07-18,46738,4296,0,Jul
782,Underrated Horror Movies | Prime Video,2020-07-17,17825,286,0,Jul
783,Absentia – Season 3 Official Trailer | Prime Video,2020-07-17,88000,531,0,Jul
784,Tales From the Loop Robots Cole's Journey | Prime Video,2020-07-16,569048,166,0,Jul
785,Chemical Hearts | First Look Clip | Amazon Prime Video,2020-07-16,169174,1042,0,Jul
786,Homecoming Season 1 Heidi and Walter Scenes | Prime Video,2020-07-15,433989,89,0,Jul
787,The Last Black Man in San Francisco Heartwarming Moments | Prime Video,2020-07-14,230677,105,0,Jul
788,Making the Cut TV Show Heidi Klum Fashion Critique | Prime Video,2020-07-13,840815,151,0,Jul
789,Jack Ryan By Tom Clancy Funny CIA Action Scenes | Prime Video,2020-07-12,105366,829,0,Jul
790,Fleabag Episode Fleabag and Boo | Prime Video,2020-07-11,70627,1874,0,Jul
791,Knives Out Film Daniel Craig Scenes | Prime Video,2020-07-10,110204,1831,0,Jul
792,Radioactive – Official U.S. Trailer | Prime Video,2020-07-10,3054256,42512,0,Jul
793,Simon Stålenhag Tales From the Loop Who is Loretta | Prime Video,2020-07-09,494587,154,0,Jul
794,Upload Season 1 Funny Afterworld Scenes | Prime Video,2020-07-08,31483,552,0,Jul
795,The Boys Season 2 - Teaser Trailer | Amazon Prime Video,2020-07-08,7301540,129612,0,Jul
796,Aeronauts Scenes That Will Make Your Heart Race,2020-07-07,45905,421,0,Jul
797,Jim Gaffigan: The Pale Tourist | New Comedy Special | Amazon Prime Video,2020-07-07,29257,186,0,Jul
798,The Last Black Man in San Francisco Skating the Bay Area | Prim Video,2020-07-06,670466,321,0,Jul
799,Tiffany Haddish Talks About Her Weird Dreams | Like a Boss,2020-07-05,8979,50,0,Jul
800,Popular Clothes in the 50's Midge Maisels Best Outfits | Prime Video,2020-07-04,808110,881,0,Jul
801,The Simple Life Show Life Skills With Paris and Nicole | Prime Video,2020-07-03,927906,285,0,Jul
802,Regular Heroes Docuseries I Episode 8 Trailer I Prime Video,2020-07-03,2039,45,0,Jul
803,The Last Black Man in San Francisco Trailer| Prime Video,2020-07-02,946610,272,0,Jul
804,The Boys Show Super Hero Bloopers | Prime Video,2020-07-01,881813,23376,0,Jul
805,Summer 2020 Video Releases | Prime Video,2020-07-01,2094298,445,0,Jul
806,"Pride: Many Stories, One Love | Amazon Prime Video",2020-06-30,2323,46,0,Jun
807,The Boys Season 2 Trailer Hunting Superheroes | Prime Video,2020-06-30,1212779,25103,0,Jun
808,Making the Cut Show Tim Gunn's Guide to Style | Prime Video,2020-06-29,14259,142,0,Jun
809,Jimmy O Yang Stand Up | Prime Video,2020-06-28,7762782,219356,0,Jun
810,Kristen Stewart Jean Seberg Scenes | Prime Video,2020-06-27,50773,416,0,Jun
811,Rocket Man Movie Outrageous Elton Fashion | Prime Video,2020-06-26,4903,51,0,Jun
812,The Boys Season 2 Trailer | Prime Video,2020-06-26,2318232,40801,0,Jun
813,The Boys Season 1 Recap Zoom Call With Patton Oswalt | Prime Video,2020-06-26,399054,5797,0,Jun
814,Watch My Spy Behind the Scenes | Prime Video,2020-06-26,26485,449,0,Jun
815,Regular Heroes Docuseries I Episode 7 Trailer I Prime Video,2020-06-26,3130,29,0,Jun
816,MY SPY Trailer | Amazon Original Movie on Prime Video,2020-06-26,1338460,309,0,Jun
817,Elton John Movie With A Taron Egerton Rocketman | Prime Video,2020-06-25,6210,102,0,Jun
818,Making the Cut TV Show Naomi Campbell Fashion Feedback | Prime Video,2020-06-23,197209,3576,0,Jun
819,The Marvelous Mrs Maisel Soundtrack | Prime Video,2020-06-22,2975312,722,0,Jun
820,Donald Glover Movie Guava Island Trailer | Prime Video,2020-06-21,102449,1042,0,Jun
821,Top 10 Best Friend Moments with June and Sharon from Forever,2020-06-20,4808,64,0,Jun
822,Homecoming Season 2 Best of Janelle Monae | Prime Video,2020-06-19,10221,141,0,Jun
823,How The Free Meek Movement Sparked Change,2020-06-19,2893,92,0,Jun
824,Hanna Season 2 - Official Trailer,2020-06-17,4974455,623,0,Jun
825,The Boys Series Satisfying Superhero Sounds | Prime Video,2020-05-30,41844,730,0,May
826,The Beautiful Friendship of Selah & Paloma | Amazon Prime Video,2020-05-29,5608,72,0,May
827,Regular Heroes Docuseries I Episode 4 Trailer I Prime Video,2020-05-29,4163,43,0,May
828,"Tales From the Loop Echo Sphere, Robots, & Travel | Prime Video",2020-05-28,10085,175,0,May
829,Upload Series Food in the Afterlife | Prime Video,2020-05-27,11095,144,0,May
830,Hunters TV Show Best of Millie | Prime Video,2020-05-26,3847,85,0,May
831,Rob Delaney Stand Up is the Best Comedy Special to Watch | Prime Video,2020-05-25,17159,165,0,May
832,Hanna Season 1 Scenes With Hanna & Sophie | Prime Video,2020-05-24,20416,348,0,May
833,Homecoming Season 2 Cast & Crew Talk with Carly | Prime Video,2020-05-24,337617,67,0,May
834,Upload Series Nathan & Nora Get Friendly | Prime Video,2020-05-23,34052,617,0,May
835,Homecoming Series Virtual Premiere Lilly Singh Host| Prime Video,2020-05-23,481830,168,0,May
836,Regular Heroes Docuseries | Episode 3 Trailer I Prime Video,2020-05-22,5655,75,0,May
837,Little Fires Everywhere Show Burning House Trailer | Prime Video,2020-05-22,1584,2,0,May
838,Girls Series Adam Driver Plays Adam Sackler | Prime Video,2020-05-21,86604,2090,0,May
839,Hanna Season 1 Fighter Girl TV Series Secrets | Prime Video,2020-05-20,6556,112,0,May
840,El Presidente | Exclusive Trailer | Prime Video,2020-05-19,586,9,0,May
841,Jimmy O Yang Shows Us What’s On His Phone,2020-05-18,44962,942,0,May
842,Gina Brillon: The Floor is Lava | New Comedy Special | Prime Video,2020-05-18,16202,133,0,May
843,Heidi Klum and Tim Gunn Join Carly on the Couch | Prime Video,2020-05-17,2458,34,0,May
844,Jack Ryan the Series Best Action Scenes | Prime Video,2020-05-16,25314,374,0,May
845,Selah and the Spades Woke Cheerleader Movie Scenes | Prime Video,2020-05-15,3777,95,0,May
846,The Aeronauts Movie Hot Air Balloon Sounds | Prime Video,2020-05-14,791325,271,0,May
847,Best Movies Streaming Now | Prime Video,2020-05-13,55967,403,0,May
848,Regular Heroes Docuseries I Episode 2 Trailer I Prime Video,2020-05-13,6983,92,0,May
849,Upload Series Cast Plays Unbox the Plot | Prime Video,2020-05-11,718730,927,0,May
850,Tribute to Awesome Moms Scene Compilation | Prime Video,2020-05-10,5243,100,0,May
851,The Boys Season 1 Kimiko Goes Wild | Prime Video,2020-05-09,80470,1508,0,May
852,Regular Heroes Docuseries I Official Trailer I Prime Video,2020-05-09,9811,108,0,May
853,Playing Would You Rather With the Cast of Upload | Prime Video,2020-05-08,649722,439,0,May
854,Undone Show Mother Daughter Relationship Animated Series | Prime Video,2020-05-07,6364,90,0,May
855,Regular Heroes Docuseries | Prime Video,2020-05-07,11411,163,0,May
856,Tales From the Loop Futuristic Special Effects | Prime Video,2020-05-06,394839,217,0,May
857,Hunters TV Show Sister Harriet's Unholy Wrath | Prime Video,2020-05-05,72043,748,0,May
858,The Best High Tech Future Scenes in the Upload Series | Prime Video,2020-05-04,32552,544,0,May
859,Making the Cut Judges Explain New Fashion Series | Prime Video,2020-05-03,457303,134,0,May
860,Happiness Continues Movie Jo Bro Top 10 | Prime Video,2020-05-02,1133709,362,0,May
861,The Upload Series Conan O'Brien Zoom Q&A with the Cast | Prime Video,2020-05-02,45809,998,0,May
862,Making the Cut Show Zoom Reunion Hosted by Tim Gunn | Prime Video,2020-05-01,654124,641,0,May
863,Tales From the Loop is Creating Stålenhag's World | Prime Video,2020-04-30,9383,126,0,Apr
864,Hanna Season 1 Badass Moments | Prime Video,2020-04-29,126716,1607,0,Apr
865,Hanna Season 2 - Official Teaser Trailer,2020-04-29,149964,1556,0,Apr
866,Making the Cut Season 1 Heidi & Tim Shop NYC | Prime Video,2020-04-28,4891,61,0,Apr
867,"HOMECOMING | Trailer – New Mystery on Prime Video May 22, 2020",2020-04-28,273605,1543,0,Apr
868,The Hunters Show Creepy Travis Scenes | Prime Video,2020-04-27,87009,1056,0,Apr
869,The Expanse TV Series Actors Understand Their Dreams | Prime Video,2020-04-26,329545,356,0,Apr
870,Satisfying Sounds from Tales From the Loop | ASMR TV Shows,2020-04-25,892564,262,0,Apr
871,The Boys Show Featuring the Badass Superhero Starlight | Prime Video,2020-04-24,16769,401,0,Apr
872,The Great Trailer Female Russian Ruler | Prime Video,2020-04-23,4100,41,0,Apr
873,Happiness Continues | Official Trailer,2020-04-23,40842,542,0,Apr
874,Hunters TV Show Best of Lonny Flash | Prime Video,2020-04-22,15968,268,0,Apr
875,Making the Cut Show Heidi & Tim Make Sushi | Prime Video,2020-04-21,5156,59,0,Apr
876,Undone TV Show Best Rosa Salazar Scenes | Prime Video,2020-04-20,344226,394,0,Apr
877,Comedy Specials by Hilarious Women | Prime Video,2020-04-19,53061,279,0,Apr
878,The Most Brutal Fleabag Godmother Scenes | Prime Video,2020-04-18,890748,11271,0,Apr
879,Selah and the Spades Best Selah Scenes | Prime Video,2020-04-17,19919,478,0,Apr
880,Modern Love Series Setting Sail Lyrics | Prime Video,2020-04-17,76904,2146,0,Apr
881,Forever Maya Rudolph & Fred Armisen's Relationship Goals | Prime Video,2020-04-16,8485,116,0,Apr
882,"In Honey Boy, Noah Jupe Plays Young Shia LaBeouf | Prime Video",2020-04-15,81611,2110,0,Apr
883,Making the Cut TV Show with Tim and Heidi Baking | Prime Video,2020-04-14,5594,64,0,Apr
884,Hunters Season 1 Scenes with Actor Logan Lerman | Prime Video,2020-04-13,40084,789,0,Apr
885,Jimmy O Yang: Good Deal | New Comedy Special | Prime Video,2020-04-13,94315,726,0,Apr
886,Undone Season 1 Father Daughter Animated Scenes | Prime Video,2020-04-12,15363,153,0,Apr
887,New Dog Detective Show From the Creator of Bosch | Prime Video,2020-04-11,158460,3443,0,Apr
888,Spongebob Memes from Spongebob Episodes | Prime Video,2020-04-10,512976,1367,0,Apr
889,The Capture - Official Trailer | Prime Video,2020-04-10,5351,24,0,Apr
890,The Capture - Official Trailer | Prime Video,2020-04-10,903,23,0,Apr
891,The Expanse Show Best Sci Fi Noises | Prime Video,2020-04-09,851052,988,0,Apr
892,"HOMECOMING | Teaser Trailer – New Mystery on Prime Video May 22, 2020",2020-04-08,83651,445,0,Apr
893,Making the Cut: Fencing Lessons | Short Cuts,2020-04-07,33029,126,0,Apr
894,Candid Hunters Cast Reactions to Set Photos | Prime Video,2020-04-06,833847,315,0,Apr
895,Jack Ryan Series Jim Greer Being Badass | Prime Video,2020-04-05,27476,358,0,Apr
